British Columbia,J's Pizza Ltd,"ABBOTSFORD, BC V2T 1V6",2,High Wage,6711,"Food counter attendants, kitchen helpers and related support occupations"
British Columbia,JS Roofing Ltd,"SURREY, BC V3W 2E5",2,High Wage,7291,Roofers and shinglers
British Columbia,Jumbo Pizza 2010 Inc,"SURREY, BC V3V 7Y1",1,High Wage,6311,Food service supervisors
British Columbia,Jump Enterprises Inc. o/a Tim Hortons,"NANAIMO, BC V9V 1W5",4,High Wage,6311,Food service supervisors
British Columbia,JVH Homes Ltd.,"Abbotsford, BC V2S 1M7",2,High Wage,7271,Carpenters
British Columbia,JVT Excavating & Demolition Ltd.,"DELTA, BC V4C 8E7",1,High Wage,7521,Heavy equipment operators (except crane)
British Columbia,JY Shinwoo Construction Ltd. o/a J.Y. Tiling Ltd.,"VICTORIA, BC V9C 0G9",4,High Wage,7283,Tilesetters
British Columbia,K & A Finishing Carpentry Ltd,"SURREY, BC V3V 7G3",1,High Wage,7271,Carpenters
British Columbia,K & M Construction Ltd,"SURREY, BC V3W 2G1",1,High Wage,0711,Construction managers
British Columbia,K & M Dube Investments Inc.,"Fernie, BC V0B 1M0",3,High Wage,6311,Food service supervisors
British Columbia,K Line Masonry Ltd,"SURREY, BC V3W 7B7",1,High Wage,7205,"Contractors and supervisors, other construction trades, installers, repairers and servicers"
British Columbia,K M Framing Ltd.,"SURREY, BC V3W 1W8",1,High Wage,7204,"Contractors and supervisors, carpentry trades"
British Columbia,Kai Japanese Restaurant Ltd.,"PORT COQUITLAM, BC V3B 0G9",1,High Wage,6322,Cooks
British Columbia,Kaler Law Corporation,"ABBOTSFORD, BC V2T 4Y1",1,High Wage,1241,Administrative assistants
British Columbia,Kaloya Skincare Spa Ltd.,"Surrey, BC V3V 4B8",1,High Wage,0651,"Managers in customer and personal services, n.e.c."
British Columbia,Kalsi Aluminum Products Manufacturing Ltd.,"Surrey, BC V3W 4E7",1,High Wage,7237,Welders and related machine operators
British Columbia,Kamal Sweets & Tandoori Hut Ltd,"Surrey, BC V3W 4E1",1,High Wage,6311,Food service supervisors
British Columbia,"Kang, Hyung Jin o/a Kita Japanese Restaurant (KITA SUSHI)","Chilliwack, BC V2R 5V9",1,High Wage,6322,Cooks
British Columbia,Kania Industries Inc.,"Nanaimo, BC V9T 5L9",1,High Wage,6342,"Tailors, dressmakers, furriers and milliners"
British Columbia,Kehar Foods International Ltd.,"SURREY, BC V3V 1B5",1,High Wage,1221,Administrative officers
British Columbia,Kelowna Flightcraft Ltd.,"Kelowna, BC V1V 1S1",17,High Wage,7315,Aircraft mechanics and aircraft inspectors
British Columbia,Kelowna Medical Massage a Massage Therapist Corporation,"Kelowna, BC V1Y 8M1",1,High Wage,3236,Massage therapists
British Columbia,Kim & Kwak Co. Enterprises Ltd.,"CHILLIWACK, BC V2R 3C7",1,High Wage,6513,Food and beverage servers
British Columbia,Kimberly Transport Ltd.,"Delta, BC V3M 5P7",5,High Wage,7511,Transport truck drivers
British Columbia,King & Queen Spa Salon Studio Inc. o/a King & Queen Studio,"Vancouver, BC V6H 1E2",1,High Wage,6341,Hairstylists and barbers
British Columbia,Kingdom Beauty Supplies (1990) Ltd.,"Vancouver, BC V5M 1M2",1,High Wage,6222,Retail and wholesale buyers
British Columbia,King's Landscaping Ltd,"Richmond, BC V6Y 2V5",1,High Wage,8255,"Contractors and supervisors, landscaping, grounds maintenance and horticulture services"
British Columbia,Kismet Estate Winery,"OLIVER, BC V0H 1T0",1,High Wage,0621,Retail and wholesale trade managers
British Columbia,Knight Rider Patrol Ltd.,"Surrey, BC V3W 1R1",1,High Wage,6316,Other services supervisors
British Columbia,K's Nails Ltd,"Richmond, BC V6X 4G4",1,High Wage,0651,"Managers in customer and personal services, n.e.c."
British Columbia,KSN Construction Ltd,"ABBOTSFORD, BC V2S 7A4",1,High Wage,7611,Construction trades helpers and labourers
British Columbia,KSS Mechanical Ltd.,"Surrey, BC V3W 6C4",2,High Wage,7251,Plumbers
British Columbia,Kudrat Electric Ltd.,"Surrey, BC V3W 2S1",1,High Wage,7241,Electricians (except industrial and power system)
British Columbia,L.T. Concrete Services Ltd,"Vancouver, BC V5P 3A7",5,High Wage,7271,Carpenters
British Columbia,Ladner Homes Ltd,"Delta, BC V4K 2X1",1,High Wage,1311,Accounting technicians and bookkeepers
British Columbia,Lally Bros Holding Ltd.,"Surrey, BC V3R 4J7",1,High Wage,1241,Administrative assistants
British Columbia,LARA VENTURES LTD.,"Penticton, BC V2A 4M1",1,High Wage,6321,Chefs
British Columbia,Larifer Venture Corporation,"Vancouver, BC V5K 1B6",1,High Wage,0714,Facility operation and maintenance managers
British Columbia,Lemonade Gluten Free Bakery Ltd.,"Vancouver, BC V5Z 2W6",1,High Wage,6332,Bakers
British Columbia,Link Insurance Services Ltd.,"SURREY, BC V3S 5K7",1,High Wage,1241,Administrative assistants
British Columbia,Link Trucking Ltd.,"Abbotsford, BC V2T 5Y1",3,High Wage,7511,Transport truck drivers
British Columbia,Liquid Lifestyles,"Clearwater, BC V0E 1N1",4,High Wage,5254,"Program leaders and instructors in recreation, sport and fitness"
British Columbia,Lo-Cost Auto Repairs Ltd.,"Richmond, BC V6X 2J2",1,High Wage,7321,"Automotive service technicians, truck and bus mechanics and mechanical repairers"
British Columbia,Lo-Cost Electrical Ltd,"Surrey, BC V3W 2B9",3,High Wage,7241,Electricians (except industrial and power system)
British Columbia,Logwin Trucking Ltd.,"SURREY, BC V3W 1A4",2,High Wage,7511,Transport truck drivers
British Columbia,Longia Enterprises Ltd.,"Victoria, BC V8Z 1E4",2,High Wage,6322,Cooks
British Columbia,LPS 3 Industries Ltd.,"DELTA, BC V4K 3N3",4,High Wage,7511,Transport truck drivers
British Columbia,Lululemon Athletica Canada Inc.,"Vancouver, BC V6J 1C7",1,High Wage,0016,Senior managers 
British Columbia,Lyn-Mar Holdings Ltd o/a Panago,"Langley, BC V3A 3N4",1,High Wage,0631,Restaurant and food service managers
British Columbia,M R P Framing Ltd,"Surrey, BC V3W 1R1",2,High Wage,7271,Carpenters
British Columbia,M&M Fencing & Landscaping Ltd.,"Surrey, BC V3W 9H9",1,High Wage,8255,"Contractors and supervisors, landscaping, grounds maintenance and horticulture services"
British Columbia,M.G. Roofing & Siding Ltd,"Surrey, BC V3W 0P1",3,High Wage,7291,Roofers and shinglers
British Columbia,Macropus Global Ltd.,"VICTORIA, BC V8N 1A4",1,High Wage,2282,User support technicians
British Columbia,Mahindra Jewellers Ltd,"Surrey, BC V3W 1R1",1,High Wage,2253,Drafting technologists and technicians
British Columbia,Mai Thai Restaurant 79 Ltd.,"Prince George, BC V2L 2A6",1,High Wage,6322,Cooks
British Columbia,Main Bodega Inc.  o/a Bodega on Main,"Vancouver, BC V6A 2W1",1,High Wage,6322,Cooks
British Columbia,Mainland Demo Contracting Ltd,"SURREY, BC V3W 0E6",1,High Wage,7302,"Contractors and supervisors, heavy equipment operator crews"
British Columbia,Mann Capital Management Corp.,"Surrey, BC V3V 0C9",1,High Wage,0113,Purchasing managers
British Columbia,Mann Construction Group Canada Ltd.,"Surrey, BC V3V 0C9",1,High Wage,1211,"Supervisors, general office and administrative support workers"
British Columbia,Manny Construction Ltd,"SURREY, BC V3X 1E3",2,High Wage,7271,Carpenters
British Columbia,Maodern Security Systems Ltd,"SURREY, BC V3W 2Y2",2,High Wage,7246,Telecommunications installation and repair workers
British Columbia,Maple Fun Tours Ltd.,"Vancouver, BC V6B 3M1",1,High Wage,6313,"Accommodation, travel, tourism and related services supervisors"
British Columbia,Maple Leaf 1st Enterprises Ltd.,"Osoyoos, BC V0H 1V2",1,High Wage,0621,Retail and wholesale trade managers
British Columbia,Maple Leaf Drywall Ltd.,"SURREY, BC V3V 4B9",2,High Wage,7284,"Plasterers, drywall installers and finishers and lathers"
British Columbia,Maple Leaf Indian Cuisine Ltd,"Maple Ridge, BC V2X 1X6",1,High Wage,0631,Restaurant and food service managers
British Columbia,Marbec Build-All Ltd,"Burnaby, BC V5G 2E3",1,High Wage,7271,Carpenters
British Columbia,Marbel Developments Ltd.,"SURREY, BC V3X 1W5",1,High Wage,1241,Administrative assistants
British Columbia,Marcels Equipment (PG) Ltd,"VERNON, BC V1B 3S1",2,High Wage,7312,Heavy
British Columbia,Marine Seafood Inc.,"Delta, BC V4G 0A2",1,High Wage,6222,Retail and wholesale buyers
British Columbia,Masala India Bistro Ltd.,"Langley, BC V3A 4E8",1,High Wage,6322,Cooks
British Columbia,Master Dental Solution Ltd.,"VANCOUVER, BC V6A 1H7",1,High Wage,3223,"Dental technologists, technicians and laboratory assistants"
British Columbia,MCG Mcintosh Construction Group,"Coquitlam, BC V3J 5G9",2,High Wage,7271,Carpenters
British Columbia,McT&T Foods Ltd.,"KELOWNA, BC V1X 5B4",3,High Wage,6311,Food service supervisors
British Columbia,MDF Tire Canada Inc,"SURREY, BC V3W 3E8",1,High Wage,0015,Senior managers 
British Columbia,Megabox Packaging Inc,"DELTA, BC V3M 6L2",1,High Wage,1215,"Supervisors, supply chain, tracking and scheduling co"
British Columbia,Metricon Construction Ltd o/a Metricon,"SURREY, BC V3W 4G1",1,High Wage,1241,Administrative assistants
British Columbia,Metro Standard Insulation Ltd,"Surrey, BC V3W 1R1",4,High Wage,7293,Insulators
British Columbia,Metro Transport Ltd,"Surrey, BC V3W 3G1",2,High Wage,7321,"Automotive service technicians, truck and bus mechanics and mechanical repairers"
British Columbia,Metro Van Custom Homes Inc.,"Richmond, BC V6W 1J5",1,High Wage,1123,"Professional occupations in advertising, marketing and public relations"
British Columbia,MII Cafe Inc.,"VANCOUVER, BC V7Y 1E8",1,High Wage,6311,Food service supervisors
British Columbia,Milani Plumbing Drainage & Heating,"Burnaby, BC V5H 2G2",2,High Wage,7251,Plumbers
British Columbia,Millenium 2000 Painting Ltd,"Coquitlam, BC V3E 3E4",2,High Wage,7294,Painters and decorators (except interior decorators)
British Columbia,Millennium Drywall Ltd,"BURNABY, BC V5B 1V1",1,High Wage,7271,Carpenters
British Columbia,Millstream Flour Mills (1991) Corporation,"Delta, BC V4G 1E4",1,High Wage,7311,Construction millwrights and industrial mechanics
British Columbia,Mink A Chocolate Cafe (01) Ltd.,"VANCOUVER, BC V5W 1W1",1,High Wage,6311,Food service supervisors
British Columbia,Mirak Foods Ltd.,"North Vancouver, BC V7M 1V9",1,High Wage,6311,Food service supervisors
British Columbia,Mirax Lumber Products Ltd.,"Abbotsford, BC V2S 7M6",1,High Wage,7312,Heavy
British Columbia,Mission Shell,"Mission, BC V2V 6C7",1,High Wage,0621,Retail and wholesale trade managers
British Columbia,Mitchell Island Terminals Ltd.,"Richmond, BC V6V 1M8",1,High Wage,1215,"Supervisors, supply chain, tracking and scheduling co"
British Columbia,MLM National Plumbing.com Inc.,"Richmond, BC V6V 1Z4",1,High Wage,7251,Plumbers
British Columbia,Mobile Zone Communication Inc.,"New Westminister, BC V3L 5H1",1,High Wage,7246,Telecommunications installation and repair workers
British Columbia,Moby Dick Restaurant Ltd.,"White Rock, BC V4B 1C9",1,High Wage,4163,Business development officers and marketing researchers and consultants
British Columbia,MOCa Beauty Salon,"Vancouver, BC V6Z 2A8",1,High Wage,0651,"Managers in customer and personal services, n.e.c."
British Columbia,Modern Niagara Vancouver Inc.,"NORTH VANCOUVER, BC V7P 3R7",1,High Wage,0711,Construction managers
British Columbia,Moe Gifts Ltd.,"ABBOTSFORD, BC V2T 6K1",1,High Wage,1221,Administrative officers
British Columbia,Moh Trucking Ltd.,"LANGLEY, BC V4W 1L1",1,High Wage,1241,Administrative assistants
British Columbia,Mon Thong Thai Restaurant (OP) Ltd.,"KELOWNA, BC V1Y 8V5",1,High Wage,6311,Food service supervisors
British Columbia,Mondo Restaurant,"Fort St John, BC V1J 3X3",1,High Wage,6322,Cooks
British Columbia,Montana`s BBQ & Bar,"Tsawwassen, BC V4M 0B3",2,High Wage,0631,Restaurant and food service managers
British Columbia,Motor-Way Truck & Trailer Repair Ltd.,"DELTA, BC V4G 1B2",1,High Wage,1241,Administrative assistants
British Columbia,Motosel Industrial Group Inc.,"COQUITLAM, BC V3K 5B1",1,High Wage,5241,Graphic designers and illustrators
British Columbia,Mott MacDonald Canada Limited,"VANCOUVER, BC V6C 2B5",1,High Wage,0711,Construction managers
British Columbia,Mountain Equipment Co-Operative,"Vancouver, BC V5T 1E1",1,High Wage,6222,Retail and wholesale buyers
British Columbia,Mplus Trading & Enterprise Ltd. o/a Fatburger Coquitlam,"Coquitlam, BC V3K 6G9",1,High Wage,6311,Food service supervisors
British Columbia,MSD Electrical Ltd,"SURREY, BC V3X 0E4",1,High Wage,2241,Electrical and electronics engineering technologists and technicians
British Columbia,Mucho Burrito Fresh Mexican Grill o/a V&S Food Limited,"VICTORIA, BC V8N 1A7",6,High Wage,6322,Cooks
British Columbia,Murrick Insurance Services (Downtown) Ltd.,"VANCOUVER, BC V6Z 2A9",1,High Wage,1241,Administrative assistants
British Columbia,"My Shanti by Vikram Vij, Inc.","VANCOUVER, BC V5Y 1M8",1,High Wage,6513,Food and beverage servers
British Columbia,N S Machining & Fabrication Co Ltd.,"Surrey, BC V3V 3S1",2,High Wage,7237,Welders and related machine operators
British Columbia,Nagra Insulation Ltd.,"SURREY, BC V3W 6N1",2,High Wage,7293,Insulators
British Columbia,National Auto Group Inc.,"COQUITLAM, BC V3B 0C4",1,High Wage,0013,Senior managers 
British Columbia,Natt Enterprises Ltd,"DELTA, BC V4G 0A4",15,High Wage,7511,Transport truck drivers
British Columbia,Natt Freightways Inc.,"Surrey, BC V3V 4S4",8,High Wage,7511,Transport truck drivers
British Columbia,Neos Business Services Inc,"RICHMOND, BC V6V 2Y8",1,High Wage,2225,Landscape and horticulture technicians and specialists
British Columbia,New 2000 Supermarket Ltd.,"Richmond, BC V6X 4A7",1,High Wage,1123,"Professional occupations in advertising, marketing and public relations"
British Columbia,New Bahia Sweet Shop & Restaurant Ltd.,"Vancouver, BC V5W 2Z5",1,High Wage,6322,Cooks
British Columbia,New Diamond Stucco Ltd,"SURREY, BC V3X 1K7",2,High Wage,7284,"Plasterers, drywall installers and finishers and lathers"
British Columbia,New Eurowest Cabinets Ltd,"SURREY, BC V3W 1H8",1,High Wage,1311,Accounting technicians and bookkeepers
British Columbia,New Millenium Tire Centre (2017) Ltd.,"SURREY, BC V3T 3E5",2,High Wage,7321,"Automotive service technicians, truck and bus mechanics and mechanical repairers"
British Columbia,New Pizza Factory Ltd.,"Maple Ridge, BC V2X 2R2",1,High Wage,6322,Cooks
British Columbia,New Vision Immigration Consultants Co. Ltd,"SURREY, BC V3W 0E6",1,High Wage,1221,Administrative officers
British Columbia,New World Canada Immigration Services Inc,"Surrey, BC V3W 1E6",1,High Wage,1221,Administrative officers
British Columbia,New World Roofing Ltd,"Surrey, BC V4N 0A9",1,High Wage,7205,"Contractors and supervisors, other construction trades, installers, repairers and servicers"
British Columbia,Nexas Roofing Ltd,"SURREY, BC V3W 6Y6",3,High Wage,7291,Roofers and shinglers
British Columbia,Nexgen Electrical,"Surrey, BC V3W 3G8",2,High Wage,7241,Electricians (except industrial and power system)
British Columbia,Next Television Productions Limited,"BURNABY, BC V5M 3Z3",1,High Wage,6742,"Other service support occupations, n.e.c."
British Columbia,Nortek Exteriors Ltd,"VICTORIA, BC V9C 4C6",3,High Wage,7291,Roofers and shinglers
British Columbia,North 49 Trucklines Inc.,"Surrey, BC V3V 2W7",5,High Wage,7511,Transport truck drivers
British Columbia,North Coast Trucking Ltd.,"Abbotsford, BC V2T 6M7",10,High Wage,7511,Transport truck drivers
British Columbia,North Road Return-It Centre,"Coquitlam, BC V3K 3V9",1,High Wage,6316,Other services supervisors
British Columbia,North Road Trading Ltd,"Richmond, BC V6X 4C4",1,High Wage,0631,Restaurant and food service managers
British Columbia,Northkamp Enterprises Inc.,"Vancouver, BC V6A 1M4",1,High Wage,5131,"Producers, directors, choreographers and related occupations"
British Columbia,Noypi Express Ltd.,"Vancouver, BC V5X 3H8",1,High Wage,7511,Transport truck drivers
British Columbia,NST Construction Ltd.,"SURREY, BC V3X 3S5",1,High Wage,7271,Carpenters
British Columbia,NW Fuel Injection Service (1983) Ltd.,"Surrey, BC V4N 4X5",1,High Wage,7312,Heavy
British Columbia,O Canada Drywall Ltd,"Delta, BC V4E 3M9",2,High Wage,7271,Carpenters
British Columbia,Octopus Academy Surrey Inc.,"SURREY, BC V3T 1W3",1,High Wage,4214,Early childhood educators and assistants
British Columbia,Odyssey International Exports (2004) Ltd,"NEW WESTMINSTER, BC V3L 5H4",1,High Wage,1241,Administrative assistants
British Columbia,Olive and Piper Inc.,"VANCOUVER, BC V6B 2V2",1,High Wage,5243,"Theatre, fashion, exhibit and other creative designers"
British Columbia,Olympic Roofing Ltd,"COQUITLAM, BC V3B 0H1",2,High Wage,7291,Roofers and shinglers
British Columbia,Omnicom Canada Corp.,"VANCOUVER, BC V6Z 2T3",1,High Wage,5241,Graphic designers and illustrators
British Columbia,On Time Moving Corp.,"PORT COQUITLAM, BC V3C 6P6",1,High Wage,0016,Senior managers 
British Columbia,One 4 All Construction Ltd.,"SURREY, BC V3W 0L1",1,High Wage,7284,"Plasterers, drywall installers and finishers and lathers"
British Columbia,Onkar Appliances Ltd.,"Surrey, BC V3W 1V9",1,High Wage,7332,Appliance servicers and repairers
British Columbia,Onstream Transport Ltd,"SURREY, BC V3W 6Y7",4,High Wage,7511,Transport truck drivers
British Columbia,Ontime Transport (1997) Inc.,"ABBOTSFORD, BC V2T 6Z6",4,High Wage,7511,Transport truck drivers
British Columbia,Optimil Machinery Inc,"Delta, BC V4G 1B5",1,High Wage,2232,Mechanical engineering technologists and technicians
British Columbia,Orbit Electric Ltd.,"Abbotsford, BC V4X 1W6",1,High Wage,1241,Administrative assistants
British Columbia,Overview Framing Ltd,"ABBOTSFORD, BC V2T 4J1",2,High Wage,7271,Carpenters
British Columbia,P.P.M.C. Gill Ltd o/a Wings Tap and Grill,"Abbotsford, BC V2S 4L5",1,High Wage,0631,Restaurant and food service managers
British Columbia,Paaraag Industrial Group Inc.,"Abbotsford, BC V2T 6H4",2,High Wage,0016,Senior managers 
British Columbia,Pacific Coast Distribution Ltd.,"Surrey, BC V4W 4B2",4,High Wage,7511,Transport truck drivers
British Columbia,PACIFIC CONCRETE CUTTERS LTD.,"BURNABY, BC V5A 2Z6",1,High Wage,7271,Carpenters
British Columbia,Pacific Ocean Transport Inc,"Abbotsford, BC V4X 1E4",15,High Wage,7511,Transport truck drivers
British Columbia,Pacin New Enterprises Inc.,"VANCOUVER, BC V6A 3M9",1,High Wage,1221,Administrative officers
British Columbia,Pagliacci Holdings Ltd.,"Abbotsford, BC V2S 2H4",1,High Wage,6322,Cooks
British Columbia,Pakcan Field Hockey Club Ltd.,"SURREY, BC V3W 0T9",2,High Wage,5252,Coaches
British Columbia,Palmaster's Tile & Stone Ltd,"NEW WESTMINSTER, BC V3M 2C9",1,High Wage,1311,Accounting technicians and bookkeepers
British Columbia,Panda Transportation Ltd,"BURNABY, BC V3N 0B1",1,High Wage,7511,Transport truck drivers
British Columbia,Pandher Building Maintenance Ltd,"Surrey, BC V3X 3R1",1,High Wage,7271,Carpenters
British Columbia,Pangea Whistler Enterprises Inc. o/a Pangea Pod Hotel,"VANCOUVER, BC V6Z 2R8",1,High Wage,6311,Food service supervisors
British Columbia,Papa Fashions Imports (2014) Ltd.,"SURREY, BC V3W 3E9",2,High Wage,1221,Administrative officers
British Columbia,Papa Plumbing & Heating Ltd.,"Surrey, BC V3S 1X6",1,High Wage,7251,Plumbers
British Columbia,Parm's Drywall Ltd.,"SURREY, BC V3V 6L8",1,High Wage,7205,"Contractors and supervisors, other construction trades, installers, repairers and servicers"
British Columbia,Pashaura Enterprises Ltd.,"SURREY, BC V3S 0L2",1,High Wage,7312,Heavy
British Columbia,Peace Park Developments Ltd,"SURREY, BC V3S 8N9",1,High Wage,0711,Construction managers
British Columbia,Peace River Hydro Partners Construction Ltd,"FORT ST. JOHN, BC V1J 4H6",5,High Wage,7521,Heavy equipment operators (except crane)
British Columbia,Peak Season Staffing Inc.,"Delta, BC V4G 0A1",1,High Wage,1223,Human resources and recruitment officers
British Columbia,Pear Tree Education Inc.,"Vancouver, BC V6K 2G3",1,High Wage,4413,Elementary and secondary school teacher assistants
British Columbia,Perfect Confection Corp. o/a Rocky Mountain Chocolate,"Delta, BC V4M 4G6",1,High Wage,6332,Bakers
British Columbia,Perfect Insulation Company Ltd.,"SURREY, BC V3T 1A3",1,High Wage,7293,Insulators
British Columbia,PH Floors Ltd.,"LANGLEY, BC V3A 8M9",1,High Wage,7283,Tilesetters
British Columbia,Pham Holding Ltd. o/a Kootenay Building Maintenance,"CRANBROOK, BC V1C 7G8",1,High Wage,1241,Administrative assistants
British Columbia,Pinch of Spice Indian Cuisine Ltd.,"Delta, BC V4C 6R4",1,High Wage,6322,Cooks
British Columbia,Piston Transport Ltd,"LANGELY, BC V2Z 1L2",5,High Wage,7511,Transport truck drivers
British Columbia,Pizza Al Forno,"Victoria, BC V8T 2W4",1,High Wage,6322,Cooks
British Columbia,Pizza Knight Ltd,"Surrey, BC V3S 9L9",1,High Wage,6322,Cooks
British Columbia,Pizza Town & Indian Cuisine Ltd.,"Coquitlam, BC V3J 1S6",1,High Wage,6711,"Food counter attendants, kitchen helpers and related support occupations"
British Columbia,Planet Express Transport Ltd,"Surrey, BC V3W 2N5",1,High Wage,1221,Administrative officers
British Columbia,Planet India Restaurant Inc.,"SURREY, BC V3W 9Z1",1,High Wage,6311,Food service supervisors
British Columbia,Polar Exterior Inc.,"PORT COQUITLAM, BC V3C 5Y8",4,High Wage,7271,Carpenters
British Columbia,Popular Truck Repair Ltd.,"RICHMOND, BC V6X 1N7",1,High Wage,7321,"Automotive service technicians, truck and bus mechanics and mechanical repairers"
British Columbia,Posi Nail & Spa Ltd,"Vancouver, BC V6B 6K5",2,High Wage,6562,"Estheticians, electrologists and related occupations"
British Columbia,Power Cool Electrical & Refrigeration Mech. Ltd.,"Burnaby, BC V5G 2S3",1,High Wage,7237,Welders and related machine operators
British Columbia,Powerful Home Construction Ltd.,"SURREY, BC V3R 1A4",3,High Wage,7284,"Plasterers, drywall installers and finishers and lathers"
British Columbia,PR Solutions Ltd,"Coquitlam, BC V3B 6B4",1,High Wage,1241,Administrative assistants
British Columbia,Prabh Construction Ltd,"SURREY, BC V3Z 1C5",1,High Wage,7271,Carpenters
British Columbia,Preet-Y Gardening Services Inc.,"SURREY, BC V3V 5T5",2,High Wage,8612,Landscaping and grounds maintenance labourers
British Columbia,Premium Fence Inc,"SURREY, BC V3S 8E5",1,High Wage,7271,Carpenters
British Columbia,PRG Homes Inc.,"SURREY, BC V3W 5X6",2,High Wage,7236,Ironworkers
British Columbia,Prime Health Ltd.,"Maple Ridge, BC V2X 0Y4",1,High Wage,1215,"Supervisors, supply chain, tracking and scheduling co"
British Columbia,Prime Packaging Company Ltd.,"RICHMOND, BC V6X  2A",1,High Wage,7381,Printing press operators
British Columbia,Primetals Technologies Austria GmbH,"VANCOUVER, BC V6C 3S7",1,High Wage,0125,Other business services managers
British Columbia,Primetals Technologies USA LLC,"VANCOUVER, BC V6C 3S7",2,High Wage,2133,Electrical and electronics engineers
British Columbia,Pro Villa Builders Ltd.,"SURREY, BC V3S 2H9",1,High Wage,7204,"Contractors and supervisors, carpentry trades"
British Columbia,Pro Villa Designs Ltd,"SURREY, BC V3S 2H9",1,High Wage,0621,Retail and wholesale trade managers
British Columbia,Pro West Security Ltd.,"SURREY, BC V3W 3J7",1,High Wage,1241,Administrative assistants
British Columbia,Project 143000 Investments Ltd,"COQUITLAM, BC V3K 6R2",1,High Wage,0711,Construction managers
British Columbia,Proline Roofing Ltd.,"Victoria, BC V8X 1H2",2,High Wage,7233,Sheet metal workers
British Columbia,Provincial Health Services Authority,"VANCOUVER, BC V6H 1G9",1,High Wage,3214,"Respiratory therapists, clinical perfusionists and cardiopulmonary technologists"
British Columbia,Prudential Transportation Ltd.,"Surrey, BC V3W 1R1",1,High Wage,1221,Administrative officers
British Columbia,PSB Drywall Ltd.,"DELTA, BC V4C 4J9",3,High Wage,7284,"Plasterers, drywall installers and finishers and lathers"
British Columbia,Punjab Construction Ltd,"ABBOTSFORD, BC V2T 3X1",2,High Wage,7271,Carpenters
British Columbia,Pura Vida,"New Westminster, BC V3L 3R5",2,High Wage,7271,Carpenters
British Columbia,Puri Carpet and Flooring Ltd,"SURREY, BC V4N 4T8",2,High Wage,7295,Floor covering installers
British Columbia,Quadra Coast Carriers Ltd.,"Vancouver, BC V5S 3E6",1,High Wage,7511,Transport truck drivers
British Columbia,Quality First Painting Ltd,"SURREY, BC V3S 5Z6",2,High Wage,7205,"Contractors and supervisors, other construction trades, installers, repairers and servicers"
British Columbia,Quick Electrical Ltd.,"SURREY, BC V3V 5P7",2,High Wage,7241,Electricians (except industrial and power system)
British Columbia,R F Bakery Equipment Ltd.,"COQUITLAM, BC V3K 6X2",1,High Wage,6314,Customer and information services supervisors
British Columbia,R S Siding Ltd,"SURREY, BC V3W 0K3",2,High Wage,7271,Carpenters
British Columbia,Rahul Glass Ltd.,"Surrey, BC V3W 1V9",1,High Wage,1215,"Supervisors, supply chain, tracking and scheduling co"
British Columbia,Rai & Sandhu Inc. o/a Max's Bakery & Deli,"Vancouver, BC V6H 2L2",1,High Wage,0631,Restaurant and food service managers
British Columbia,Raiwal Agro Tech Foods Ltd,"SURREY, BC V3S 0L5",1,High Wage,1241,Administrative assistants
British Columbia,Rama Sweets & Restaurant Ltd,"Surrey, BC V3W 3M8",2,High Wage,6322,Cooks
British Columbia,RBMK Transportation Ltd,"SURREY, BC V3V 1J7",2,High Wage,7511,Transport truck drivers
British Columbia,RDX Royal Drivers Xpress Inc.,"ABBOTSFORD, BC V2T 2V3",2,High Wage,7511,Transport truck drivers
British Columbia,Reddot Biotech Inc,"Kelowna, BC V1W 4V3",1,High Wage,0015,Senior managers 
British Columbia,Redemption Contracting INC,"Burnaby, BC V5B 3N3",1,High Wage,7271,Carpenters
British Columbia,Regal Exterior Ltd.,"SURREY, BC V3W 7G2",2,High Wage,7284,"Plasterers, drywall installers and finishers and lathers"
British Columbia,Reliable Insulation Ltd.,"SURREY, BC V3V 1T8",3,High Wage,7293,Insulators
British Columbia,Reliable Landscaping Ltd.,"SURREY, BC V3S 8Y9",3,High Wage,2225,Landscape and horticulture technicians and specialists
British Columbia,Reliance Autotek Ltd.,"SURREY, BC V3W 3A7",1,High Wage,1311,Accounting technicians and bookkeepers
British Columbia,Rexler Homes & Construction Ltd,"SURREY, BC V3W 2M4",1,High Wage,7204,"Contractors and supervisors, carpentry trades"
