Saskatchewan,Muchowski Farms Ltd.,"Odessa, SK S0G 3S0",1,Primary Agriculture,8431,General farm workers,50.283905,-103.783683
Saskatchewan,Northern Konstar Seedpotatoes Ltd.,"OUTLOOK, SK S0L 2N0",2,Primary Agriculture,8431,General farm workers,51.356405,-107.164226
Saskatchewan,Sucor Farms Ltd.,"Plenty, SK S0L 2R0",2,Primary Agriculture,8431,General farm workers,51.782978,-108.640592
Saskatchewan,Ter Keurs Bros Inc,"Strasbourg, SK S0G 4V0",2,Primary Agriculture,8431,General farm workers,51.258628,-104.833384
Saskatchewan,Veikle Seeds Ltd,"Cut Knife, SK S0M 0N0",2,Primary Agriculture,8252,"Agricultural service contractors, farm supervisors and specialized livestock workers",52.62608,-109.001804
Saskatchewan,Welsch Farms Inc.,"Cut Knife, SK S0M 0N0",1,Primary Agriculture,8252,"Agricultural service contractors, farm supervisors and specialized livestock workers",52.62608,-109.001804
Saskatchewan,Western Alfalfa Milling Co. Ltd.,"Norquay, SK S0A 2V0",1,Primary Agriculture,8431,General farm workers,51.8834495544434,-102.084541320801
Saskatchewan,Windy Ridge Ranching Co. Ltd.,"ELROSE, SK S0L  0Z",1,Primary Agriculture,8252,"Agricultural service contractors, farm supervisors and specialized livestock workers",,
Saskatchewan,Samplepop Technologies Inc.,"SASKATOON, SK S7W 0T6",1,Samplepop Technologies Inc.,0213,Computer and information systems managers,52.14766,-106.561463
Alberta,1036302 Alberta Ltd,"EDMONTON, AB T6E 5X5",3,1036302 Alberta Ltd,7511,Transport truck drivers,53.468678,-113.486188
Alberta,1040023 Alberta Ltd,"Sherwood Park, AB T8H 0L5",1,High Wage,7305,"Supervisors, motor transport and other ground transit operators",53.553108,-113.274529
Alberta,1046679 Alberta Ltd o/a Jas Transport,"Edmonton, AB T6T 0H7",2,High Wage,7511,Transport truck drivers,53.47077,-113.370754
Alberta,1068851 Alberta Ltd o/a Spectra & Homebath,"CALGARY, AB T2B 3R2",1,High Wage,7272,Cabinetmakers,51.014896,-113.95832
Alberta,1147203 Alberta Ltd.,"EDMONTON, AB T5Z 3R3",3,High Wage,7511,Transport truck drivers,53.625845,-113.449119
Alberta,1164797 Alberta Ltd o/a Shan Trucking,"EDMONTON, AB T6P 1S1",1,High Wage,1215,"Supervisors, supply chain, tracking and scheduling co",53.501987,-113.347397
Alberta,1223209 Alberta Ltd,"SHERWOOD PARK, AB T8H 1X7",10,High Wage,7511,Transport truck drivers,53.5495031,-113.2543074
Alberta,1393189 Alberta Ltd o/a Canada Best Value Inn,"Calgary, AB T2H 0J3",1,High Wage,6315,Cleaning supervisors,51.007123,-114.069096
Alberta,1431716 Alberta Ltd o/a West Edmonton Truck Wash,"Edmonton, AB T5V 1M8",2,High Wage,6315,Cleaning supervisors,53.5705193,-113.6119537
Alberta,1445829 Alberta Ltd.,"EDMONTON, AB T6T 0H6",1,High Wage,1221,Administrative officers,53.456207,-113.387664
Alberta,1558707 Alberta Ltd. o/a Reads Heating Edmonton,"EDMONTON, AB T6E 5K8",1,High Wage,1123,"Professional occupations in advertising, marketing and public relations",53.486821,-113.45752
Alberta,1563577 Alberta Ltd,"Calgary, AB T2K 6H2",1,High Wage,0621,Retail and wholesale trade managers,51.111296,-114.056609
Alberta,1604820 Alberta Ltd.,"EDMONTON, AB T6X 0S9",1,High Wage,7511,Transport truck drivers,53.4158884,-113.4447708
Alberta,1691358 Alberta Ltd.,"Calgary, AB T2E 6R7",1,High Wage,1221,Administrative officers,51.088256,-114.011406
Alberta,1740968 Alberta Ltd. o/a DK Concrete Work,"EDMONTON, AB T6X 0M6",1,High Wage,7282,Concrete finishers,53.4217628,-113.4354001
Alberta,1767814 Alberta Ltd.,"WARBURG, AB T0C 2T0",1,High Wage,6322,Cooks,53.177931,-114.321413
Alberta,1772399 Alberta Ltd. o/a GNU Construction,"Fort Mcmurray, AB T9K 1S7",2,High Wage,7284,"Plasterers, drywall installers and finishers and lathers",56.7380091,-111.4414564
Alberta,1781606 Alberta Ltd. o/a Diva Nails 1,"EDMONTON, AB T6X 0P2",1,High Wage,0651,"Managers in customer and personal services, n.e.c.",53.4242092,-113.4752458
Alberta,1800383 Alberta Inc.,"EDMONTON, AB T6T 0Z4",2,High Wage,7511,Transport truck drivers,53.481424,-113.377871
Alberta,1823856 Alberta Ltd,"EDMONTON, AB T5N 2N8",2,High Wage,3114,Veterinarians,53.5432285,-113.5656052
Alberta,1832107 Alberta Ltd o/a Nite Star Truckwash,"Edmonton, AB T6V 1W4",1,High Wage,6315,Cleaning supervisors,53.602132,-113.551723
Alberta,1841830 Alberta Ltd. O/A Bill's Peking House,"Calgary, AB T2J 7C3",1,High Wage,1226,Conference and event planners,50.930358,-114.06534
Alberta,1843596 Alberta Ltd,"GRANDE PRAIRIE, AB T8V 3J9",1,High Wage,0632,Accommodation service managers,55.17063,-118.81384
Alberta,1846806 Alberta Ltd. o/a Smart Energy Alternatives,"EDMONTON, AB T5M 2S2",1,High Wage,1215,"Supervisors, supply chain, tracking and scheduling co",53.559099,-113.60393
Alberta,1900213 Alberta Ltd,"CALGARY, AB T2M 2R5",1,High Wage,0651,"Managers in customer and personal services, n.e.c.",51.065504,-114.063772
Alberta,1919998 ALBERTA INC.,"CALGARY, AB T2Z 0P7",1,High Wage,7283,Tilesetters,50.9182937,-113.9547061
Alberta,1926679 Alberta Ltd. o/a Circle K,"Sylvan Lake, AB T4S 2M2",1,High Wage,0621,Retail and wholesale trade managers,52.297705,-114.105556
Alberta,1954347 Alberta Ltd.,"Slave Lake, AB T0G 2A0",1,High Wage,7321,"Automotive service technicians, truck and bus mechanics and mechanical repairers",55.288095,-114.769951
Alberta,1968095 Alberta Ltd o/a Alberta Avenue Clinic and Pharmacy,"Edmonton, AB T5G 0N6",1,High Wage,3112,General practitioners and family physicians,53.570382,-113.485868
Alberta,1971679 Alberta Inc. o/a Energie Hair Studio,"Edmonton, AB T6M 0M8",1,High Wage,1221,Administrative officers,53.4663985,-113.6415805
Alberta,1979592 Alberta Ltd.,"SPRUCE GROVE, AB T7X 2Z8",1,High Wage,0621,Retail and wholesale trade managers,53.541782,-113.903498
Alberta,2042886 Alberta Ltd o/a Dr. Phone Fix,"EDMONTON, AB T5Z 3S3",1,High Wage,7246,Telecommunications installation and repair workers,53.628604,-113.491233
Alberta,2054101 Alberta Ltd.,"EDMONTON, AB T6T 0M1",1,High Wage,1215,"Supervisors, supply chain, tracking and scheduling co",53.46096,-113.368469
Alberta,2091000 Alberta Ltd.,"Beaverlodge, AB T0H 0C0",3,High Wage,6322,Cooks,55.20956,-119.42729
Alberta,2110153 Alberta Ltd o/a Duggan Car Wash,"Edmonton, AB T6W 2W9",1,High Wage,0651,"Managers in customer and personal services, n.e.c.",53.469935,-113.634387
Alberta,2116999 Alberta Ltd,"CALGARY, AB T3K 4W1",1,High Wage,0621,Retail and wholesale trade managers,51.145054,-114.05805
Alberta,3D Concrete & Gravel Ltd.,"CALGARY, AB T2M 4L5",1,High Wage,1241,Administrative assistants,51.083746,-113.90007
Alberta,4 Wheel Collision - Frame Ltd.  o/a Fix Auto Edmonton East,"Edmonton, AB T6B 2H8",2,High Wage,7322,Motor vehicle body repairers,53.512352,-113.406606
Alberta,41-9 Argo Ltd.,"Oyen, AB T0J 2J0",1,High Wage,2123,"Agricultural representatives, consultants and specialists",51.49258,-110.097617
Alberta,5678 Dynamic Wellness & Fine Arts Studio Inc.,"KITSCOTY, AB T0B 2P0",1,High Wage,5134,Dancers,53.340797,-110.334047
Alberta,592365 Alberta Ltd,"LETHBRIDGE, AB T1J 1Z9",2,High Wage,6322,Cooks,49.695484,-112.84184
Alberta,607433 Alberta Ltd,"EDMONTON, AB T6T 1W6",3,High Wage,7511,Transport truck drivers,53.466604,-113.386779
Alberta,735430 Alberta Ltd  o/a  S J Trucking,"EDMONTON, AB T6X 2C5",4,High Wage,7511,Transport truck drivers,53.404202,-113.435908
Alberta,7521685 Canada Ltd o/a Pablaws Tax Services,"EDMONTON, AB T6E 5X7",1,High Wage,1221,Administrative officers,53.476494,-113.470263
Alberta,812252 Alberta Ltd.,"SHERWOOD PARK, AB T8H 2T1",5,High Wage,8255,"Contractors and supervisors, landscaping, grounds maintenance and horticulture services",53.526812,-113.297048
Alberta,911330 Alberta Ltd. o/a Alberta Arborists,"Edmonton, AB T6P 1R3",1,High Wage,2225,Landscape and horticulture technicians and specialists,53.489059,-113.344406
Alberta,986428 Alberta Ltd o/a Delton Grocery,"EDMONTON, AB T5B 3S8",1,High Wage,0621,Retail and wholesale trade managers,53.576839,-113.476203
Alberta,A & H Steel Ltd,"Edmonton, AB T6B 0E4",1,High Wage,7201,"Contractors and supervisors, machining, metal forming, shaping and erecting trades and related occupations",53.517881,-113.412894
Alberta,A R General Contractors Ltd.,"Calgary, AB T3J 4V5",2,High Wage,7284,"Plasterers, drywall installers and finishers and lathers",51.128176,-113.955822
Alberta,A&J Logistics Ltd.,"EDMONTON, AB T6X 1M4",2,High Wage,7511,Transport truck drivers,53.430225,-113.469547
Alberta,A&T Talents LTD,"Calgary, AB T2K 3T2",1,High Wage,0013,Senior managers ,51.109307,-114.068039
Alberta,A1 Group of Companies Ltd.,"Fort McMurray, AB T9H 5C8",6,High Wage,7511,Transport truck drivers,56.666179,-111.3201538
Alberta,ABS Trucking Ltd,"Edmonton, AB T5W 5J6",3,High Wage,1525,Dispatchers,53.581016,-113.433424
Alberta,Actalign Inc.,"EDMONTON, AB T5T 5L4",1,High Wage,6221,Technical sales specialists ,53.5336483,-113.6150236
Alberta,Action Dignity Society,"CALGARY, AB T2A 6T2",1,High Wage,1311,Accounting technicians and bookkeepers,51.059642,-113.985993
Alberta,Action Flooring Ltd,"EDMONTON, AB T6B 3B7",1,High Wage,0711,Construction managers,53.505138,-113.418071
Alberta,Acuren Group Inc,"Sherwood Park, AB T8H 2K8",1,High Wage,7384,"Other trades and related occupations, n.e.c.",53.555798,-113.342059
Alberta,AdvancEra Consulting Inc.,"CALGARY, AB T3M 0H6",1,High Wage,1122,Professional occupations in business management consulting,50.878674,-113.948718
Alberta,AJ Exteriors & Interiors Ltd,"CALGARY, AB T2M 4L5",1,High Wage,7284,"Plasterers, drywall installers and finishers and lathers",51.083746,-113.90007
Alberta,Akal Cargo Ltd,"EDMONTON, AB T6E 6M8",5,High Wage,7511,Transport truck drivers,53.4753635,-113.4821959
Alberta,Akal Drywall & Contracting Ltd,"EDMONTON, AB T6T 0A3",1,High Wage,7284,"Plasterers, drywall installers and finishers and lathers",53.459671,-113.373742
Alberta,Alberta Drywall & Renovations Inc,"CALGARY, AB T2Z 4S2",10,High Wage,7284,"Plasterers, drywall installers and finishers and lathers",50.914611,-113.938325
Alberta,Alberta Health Services,"EDMONTON, AB T5J 3E4",10,High Wage,3111,Specialist physicians,53.53951,-113.50488
Alberta,Anand Carpentry & Construction Ltd.,"Edmonton, AB T6T 1Y8",1,High Wage,7294,Painters and decorators (except interior decorators),53.466763,-113.386423
Alberta,Ananta Enterprises Ltd,"EDMONTON, AB T6T 1Y7",1,High Wage,2242,Electronic service technicians (household and business equipment),53.46812,-113.385293
Alberta,Andrew Benison Enterprises Corp. o/a AB Enterprises Corp.,"Rockyview, AB T1X 0K3",2,High Wage,7312,Heavy,51.01741,-113.837836
Alberta,Anttal Transportation Ltd,"EDMONTON, AB T6T 0V2",1,High Wage,1241,Administrative assistants,53.47097,-113.383845
Alberta,Anup Kumar Sharma & Sons Ltd.,"GRAND PRAIRIE, AB T8W 2R2",2,High Wage,6211,Retail sales supervisors,55.154004,-118.84545
Alberta,ANZ Collision Inc. o/a Alis Auto Frame and Detail Shop,"Calgary, AB T3J 4N4",1,High Wage,7322,Motor vehicle body repairers,51.100562,-113.96599
Alberta,Aqua Max Truck & Carwash,"Slave Lake, AB T0G 2A0",2,High Wage,0651,"Managers in customer and personal services, n.e.c.",55.288095,-114.769951
Alberta,Artistic Stucco Ltd,"FOOTHILLS, AB T1S 4R9",1,High Wage,7284,"Plasterers, drywall installers and finishers and lathers",50.72211,-113.962246
Alberta,Associated Engineering Alberta Ltd,"EDMONTON, AB T5J 5C6",1,High Wage,2131,Civil engineers,53.5413509,-113.4883329
Alberta,Aurora Industries Ltd.,"EDMONTON, AB T6E 5R6",2,High Wage,7384,"Other trades and related occupations, n.e.c.",53.478668,-113.4752735
Alberta,Azad Logistics Ltd,"EDMONTON, AB T6X 0C2",1,High Wage,7511,Transport truck drivers,53.424879,-113.459013
Alberta,Aztec Landscaping Ltd,"GRANDE PRAIRIE, AB T8V 4N4",1,High Wage,2225,Landscape and horticulture technicians and specialists,55.1739502,-118.8104744
Alberta,Bajwa Trucklines Inc.,"Calgary, AB T3N 0M5",2,High Wage,7511,Transport truck drivers,51.132246,-113.976608
Alberta,Bannerz Canada Inc,"Edmonton, AB T6E 1K8",1,High Wage,1311,Accounting technicians and bookkeepers,53.512414,-113.48626
Alberta,Bearstone Ex Inc.,"Calgary, AB T3S 0A2",1,High Wage,7281,Bricklayers,50.9607036,-113.9067195
Alberta,Berstad Construction Ltd.,"CALGARY, AB T2J 3Y4",1,High Wage,7271,Carpenters,50.926369,-114.031097
Alberta,Best Truck Service and Automotive (Peace River) Ltd,"Peace River, AB T8S 0A5",1,High Wage,7321,"Automotive service technicians, truck and bus mechanics and mechanical repairers",56.2416697,-117.3387418
Alberta,Bindi's Drywall & Plastering Ltd.,"Edmonton, AB T5Y 0H3",1,High Wage,7284,"Plasterers, drywall installers and finishers and lathers",53.626994,-113.419827
Alberta,Bright Custom Homes Inc.,"CALGARY, AB T2K 0Y2",1,High Wage,7284,"Plasterers, drywall installers and finishers and lathers",51.0841045,-114.0666605
Alberta,Buttar Woodworks Ltd.,"EDMONTON, AB T6T 0R6",1,High Wage,7204,"Contractors and supervisors, carpentry trades",53.47097,-113.383845
Alberta,Byblos Bakery Ltd.,"Calgary, AB T2E 8J8",1,High Wage,9213,"Supervisors, food, beverage and associated products processing",51.070822,-114.004115
Alberta,C5 Rodeo Company Inc,"Lac La Biche, AB T0A 2C0",1,High Wage,5131,"Producers, directors, choreographers and related occupations",54.701965,-112.10008
Alberta,Calgary Exhibition & Stampede Ltd,"Calgary, AB T2P 2K8",1,High Wage,5225,Audio and video recording technicians,51.049705,-114.058229
Alberta,Caliber Master Builder Ltd,"Edmonton, AB T6E 5X4",2,High Wage,7284,"Plasterers, drywall installers and finishers and lathers",53.4878451,-113.4658924
Alberta,Calpol General Painting Ltd,"Calgary, AB T2V 4K7",2,High Wage,7294,Painters and decorators (except interior decorators),50.973734,-114.133804
Alberta,Canada Grand Enterprises Inc.,"EDMONTON, AB T6E 5P3",1,High Wage,0015,Senior managers ,53.484726,-113.479451
Alberta,Canadian Cribbing (EDM) Ltd.,"Edmonton, AB T6N 1A8",1,High Wage,7282,Concrete finishers,53.459847,-113.489372
Alberta,Canadian Ministries for Islamic Learning o/a Jamia Riyadhul Jannah Edmonton,"Edmonton, AB T6X 1A3",1,High Wage,4154,Professional occupations in religion,53.430699,-113.443879
Alberta,Canadian Pacific Railway Company,"Calgary, AB T2C 4X9",1,High Wage,0731,Managers in transportation,50.991871,-114.002288
Alberta,Canus Enterprises Inc,"EDMONTON, AB T6T 0H2",3,High Wage,7511,Transport truck drivers,53.4631716,-113.3708877
Alberta,Career Plus Immigration Consultants Inc.,"EDMONTON, AB T6E 5Y1",1,High Wage,1221,Administrative officers,53.46857,-113.467846
Alberta,Cemrock Concrete & Construction Ltd.,"CALGARY, AB T2B 1M4",3,High Wage,7282,Concrete finishers,51.033082,-113.964354
Alberta,Cervus Equipment Corporation,"Calgary, AB T3K 0S3",1,High Wage,0621,Retail and wholesale trade managers,50.966961,-114.063386
Alberta,Chateau Beirut,"Edmonton, AB T5Z 3P5",1,High Wage,6322,Cooks,53.624321,-113.480826
Alberta,Christensen & McLean Roofing Co.,"Edmonton, AB T5V 1H8",10,High Wage,7291,Roofers and shinglers,53.592056,-113.603022
Alberta,CKB Construction Ltd.,"Edmonton, AB T5S 1Z9",8,High Wage,7282,Concrete finishers,53.553634,-113.679571
Alberta,Cogent Transport Inc,"CALGARY, AB T3J 5K4",3,High Wage,7511,Transport truck drivers,51.130679,-113.938
Alberta,Complete Care Restoration Services,"EDMONTON, AB T5M 3E8",1,High Wage,7271,Carpenters,53.567806,-113.57392
Alberta,Core-Mark International Inc,"Calgary, AB T2C 1H7",3,High Wage,7305,"Supervisors, motor transport and other ground transit operators",50.9811265,-113.9891025
Alberta,Count On Us Janitorial Ltd,"Edmonton, AB T6T 1N5",1,High Wage,6315,Cleaning supervisors,53.476352,-113.377157
Alberta,Courage Deep Canada Inc,"Edmonton, AB T5Y 3N2",3,High Wage,7511,Transport truck drivers,53.627297,-113.436466
Alberta,CPR Group Ltd.,"CALGARY, AB T3H 4V5",1,High Wage,7291,Roofers and shinglers,51.022317,-114.188587
Alberta,Craftcore Homes Ltd.,"CALGARY, AB T3J 3E3",1,High Wage,7204,"Contractors and supervisors, carpentry trades",51.114962,-113.954159
Alberta,D & G Sekhon Drywalling Inc,"CALGARY, AB T1Y 2Y4",2,High Wage,7284,"Plasterers, drywall installers and finishers and lathers",51.092301,-113.968324
Alberta,DAP Group Ltd.,"FORT MCMURRAY, AB T9X 0Y5",1,High Wage,1221,Administrative officers,,
Alberta,Day Stucco Ltd.,"CALGARY, AB T3N 0E3",2,High Wage,7284,"Plasterers, drywall installers and finishers and lathers",51.1725009,-113.958222
Alberta,Deol Drywall Ltd.,"CALGARY, AB T3N 0C9",1,High Wage,7284,"Plasterers, drywall installers and finishers and lathers",51.1554568,-113.9628261
Alberta,Deol Transport Ltd.,"Edmonton, AB T6X 1K9",3,High Wage,7511,Transport truck drivers,53.42117,-113.446465
Alberta,Deol Trucking Services Inc,"Chestermere, AB T1X 0E9",4,High Wage,7511,Transport truck drivers,51.0298766,-113.8304987
Alberta,Donison & Associates Ltd.,"SHERWOOD PARK, AB T8A 1W4",1,High Wage,7235,Structural metal and platework fabricators and fitters,53.5128958,-113.3009276
Alberta,Dovmar Drywall Ltd.,"CALGARY, AB T2X 0N1",1,High Wage,7284,"Plasterers, drywall installers and finishers and lathers",50.908719,-114.030404
Alberta,DTS Trucking Ltd.,"EDMONTON, AB T6X 0G4",2,High Wage,7511,Transport truck drivers,53.4195,-113.521451
Alberta,Edmonton Gear Centre Ltd.,"EDMONTON, AB T5M 3E8",1,High Wage,7321,"Automotive service technicians, truck and bus mechanics and mechanical repairers",53.567806,-113.57392
Alberta,EGM Drywall Systems Inc,"Edmonton, AB T5S 1K3",5,High Wage,7284,"Plasterers, drywall installers and finishers and lathers",53.55326,-113.637787
Alberta,Enhanced Installs Ltd.,"Calgary, AB T3K 1E1",1,High Wage,7283,Tilesetters,51.127023,-114.085312
Alberta,Euro Marble Tiles & Granite Ltd,"Edmonton, AB T5J 3N1",1,High Wage,7284,"Plasterers, drywall installers and finishers and lathers",53.542865,-113.501093
Alberta,Exclusive Drywall Ltd.,"EDMONTON, AB T6X 0P2",3,High Wage,7284,"Plasterers, drywall installers and finishers and lathers",53.4242092,-113.4752458
Alberta,Expanding Imaginations Child Care Inc.,"Calgary, AB T2J 6T6",1,High Wage,4214,Early childhood educators and assistants,50.927314,-114.030002
Alberta,Fancy Doors & Mouldings Ltd,"Edmonton, AB T6B 3S5",1,High Wage,2243,Industrial instrument technicians and mechanics,53.519502,-113.425859
Alberta,Fast Appliance Repair Ltd.,"CALGARY, AB T3M 2K3",1,High Wage,7332,Appliance servicers and repairers,50.887318,-113.970139
Alberta,Fine Arts Drywall Ltd,"EDMONTON, AB T5S 0L1",2,High Wage,7284,"Plasterers, drywall installers and finishers and lathers",53.559504,-113.625237
Alberta,G K Projects Inc. o/a Great Western Interiors,"CALGARY, AB T2Z 4A3",1,High Wage,7284,"Plasterers, drywall installers and finishers and lathers",50.934699,-113.983183
Alberta,GCS General Contracting Services Inc,"Sturgeon County, AB T8T 0T8",2,High Wage,7282,Concrete finishers,53.806738,-113.448407
Alberta,Genconian's Transport Inc.,"AIRDRIE, AB T4A 0K3",3,High Wage,7511,Transport truck drivers,51.2895507,-113.9806421
Alberta,Gilbert Trucking Ltd,"CALGARY, AB T3M 0H5",1,High Wage,7511,Transport truck drivers,50.878674,-113.948718
Alberta,GillBuilt Homes Ltd,"EDMONTON, AB T5Z 3Y6",4,High Wage,7205,"Contractors and supervisors, other construction trades, installers, repairers and servicers",53.629381,-113.46433
Alberta,GLC Vet Services Ltd. o/a City Centre Animal Hospital,"AIRDRIE, AB T4B 3M2",1,High Wage,1221,Administrative officers,51.286935,-114.013529
Alberta,Glengary Bison Ltd o/a Glengary Bison,"AIRDRIE, AB T4B 2A3",1,High Wage,5254,"Program leaders and instructors in recreation, sport and fitness",51.284442,-114.012916
Alberta,GM Granite & Marble Ltd.,"Calgary, AB T2E 6M3",1,High Wage,7205,"Contractors and supervisors, other construction trades, installers, repairers and servicers",51.0945235,-114.0309095
Alberta,Golden Light Enterprises Ltd o/a Children's Academy Daycare,"Edmonton, AB T6E 6P1",1,High Wage,1221,Administrative officers,53.469917,-113.466263
Alberta,Goodfellas Ink Inc.,"Edmonton, AB T5G 0P4",1,High Wage,0651,"Managers in customer and personal services, n.e.c.",53.5703781,-113.4918869
Alberta,Goran Contracting Ltd.,"EDMONTON, AB T6M 0L9",2,High Wage,7282,Concrete finishers,53.4663985,-113.6415805
Alberta,Gordion Construction Ltd.,"Edmonton, AB T6E 6T7",1,High Wage,0601,Corporate sales managers,53.483422,-113.472741
Alberta,Granite Warehouse Inc.,"Leduc, AB T9E 8M4",1,High Wage,0601,Corporate sales managers,53.296367,-113.525071
Alberta,GRH Transport Services Ltd.,"Calgary, AB T3N 0M5",4,High Wage,7511,Transport truck drivers,51.132246,-113.976608
Alberta,Groundswell Group Inc.,"CALGARY, AB T2R 0K1",4,High Wage,2171,Information systems analysts and consultants,51.0425558,-114.0662929
Alberta,Gurmya Group Inc.,"Calgary, AB T3J 0C5",3,High Wage,6211,Retail sales supervisors,51.1275302,-113.955598
Alberta,H.P.C Transport Ltd,"EDMONTON, AB T5Y 6A9",2,High Wage,7511,Transport truck drivers,53.6389357,-113.3934146
Alberta,Harman Cheap Tiles & Granite Ltd,"Edmonton, AB T6T 0K1",2,High Wage,7283,Tilesetters,53.466612,-113.383673
Alberta,Harminder Transport Ltd,"EDMONTON, AB T6L 4M8",1,High Wage,7305,"Supervisors, motor transport and other ground transit operators",53.455991,-113.406728
Alberta,Harmony Ceramic Dental Laboratory Ltd,"Calgary, AB T3E 6V2",1,High Wage,3223,"Dental technologists, technicians and laboratory assistants",51.021578,-114.161226
Alberta,Harshaan Sidhu Trucking Ltd,"Edmonton, AB T6X 1T6",2,High Wage,7511,Transport truck drivers,53.431959,-113.464225
Alberta,Harvey Rao Professional Corporation o/a Deansgate Medical Clinic,"Edmonton, AB T6V 0T1",1,High Wage,0124,"Advertising, marketing and public relations managers",53.611899,-113.553904
Alberta,Herina 16 Construction Ltd,"Calgary, AB T2Y 4G2",2,High Wage,7283,Tilesetters,50.896241,-114.111549
Alberta,Herman 123 Ltd,"Burdett, AB T0K 0J0",5,High Wage,7235,Structural metal and platework fabricators and fitters,49.8228,-111.664838
Alberta,Innovative Pipeline Crossings Inc,"CALGARY, AB T2X 1P1",1,High Wage,7311,Construction millwrights and industrial mechanics,50.9082485,-114.0622455
Alberta,Inside and Out Painters Ltd. o/a Inside and Out Painters,"Fort McMurray, AB T9K 2Y2",1,High Wage,7205,"Contractors and supervisors, other construction trades, installers, repairers and servicers",56.74139,-111.450789
Alberta,International Painting and Drywall Co Ltd,"Edmonton, AB T5L 1C9",7,High Wage,7284,"Plasterers, drywall installers and finishers and lathers",53.580995,-113.542884
Alberta,International Trading Partner Ltd.,"ROCKY VIEW NO. 44, AB T1X 1X6",1,High Wage,1123,"Professional occupations in advertising, marketing and public relations",50.9503875,-113.7725197
Alberta,IRISNDT Corp,"Edmonton, AB T6E 5T8",1,High Wage,0211,Engineering managers,53.490194,-113.454818
Alberta,Jai Maa Enterprises Ltd o/a Macs Store,"Edmonton, AB T6K 3L6",1,High Wage,6211,Retail sales supervisors,53.476703,-113.390152
Alberta,JFGV Drywall Ltd,"EDMONTON, AB T6L 2Y6",2,High Wage,7284,"Plasterers, drywall installers and finishers and lathers",53.446629,-113.418365
Alberta,Johal BK Logistics Ltd,"EDMONTON, AB T6T 0Z2",2,High Wage,7511,Transport truck drivers,53.438882,-113.388589
Alberta,Josun Enterprise Ltd. o/a Izumi Yokozuna Sushi House,"Calgary, AB T2W 4X9",1,High Wage,6322,Cooks,50.9637251,-114.073997
Alberta,Jupiter Enterprises Ltd.,"CALGARY, AB T2H 0R2",1,High Wage,0621,Retail and wholesale trade managers,50.997793,-114.0667755
Alberta,Kahlon Trucking & Transport Inc.,"EDMONTON, AB T6T 2A6",2,High Wage,7511,Transport truck drivers,53.466457,-113.383185
Alberta,Kanata International Ltd,"CALGARY, AB T2V 3K4",1,High Wage,0013,Senior managers ,50.96949,-114.090324
Alberta,Kantrax Contractors Ltd,"LEDUC, AB T9E 0R8",11,High Wage,7282,Concrete finishers,53.2884816,-113.5217383
Alberta,KB Construction Inc.,"CALGARY, AB T2K 5Y1",1,High Wage,7271,Carpenters,51.098486,-114.092011
Alberta,Kee Tas Kee Now Tribal Council Education Authority Ltd.  o/a Kee Tas Kee Now Education Authority,"Red Earth Creek, AB T0G 1X0",1,High Wage,0213,Computer and information systems managers,56.542324,-115.38677
Alberta,Khinda Transport Ltd.,"EDMONTON, AB T6T 1A9",3,High Wage,7511,Transport truck drivers,53.47684,-113.366215
Alberta,Kings Alliance Group Inc,"EDMONTON, AB T6B 2P4",6,High Wage,7511,Transport truck drivers,53.488003,-113.440675
Alberta,Koman Janitorial Services Ltd.,"Edmonton, AB T6L 7E5",1,High Wage,6315,Cleaning supervisors,53.473005,-113.407133
Alberta,Kris Tile Inc,"Edmonton, AB T5V 1R3",2,High Wage,7283,Tilesetters,53.572834,-113.610144
Alberta,Lafarge Canada Inc,"EDMONTON, AB T5S 2T8",13,High Wage,7282,Concrete finishers,53.559797,-113.699833
Alberta,Lethbridge Thai Massage & Spa Inc,"LETHBRIDGE, AB T1H 2M6",1,High Wage,3236,Massage therapists,49.702915,-112.825576
Alberta,Liana Harper Professional Corporation,"COALDALE, AB T1M 1M7",1,High Wage,3122,Chiropractors,49.711094,-112.655869
Alberta,Lift Boss Inc,"Edmoton, AB T5B 1G3",1,High Wage,7312,Heavy,53.5815728,-113.4542755
Alberta,Little India Restaurant,"Edmonton, AB T6E 5P2",2,High Wage,6322,Cooks,53.46565,-113.471746
Alberta,Load Express Transport Inc,"EDMONTON, AB T6X 1P3",6,High Wage,7511,Transport truck drivers,53.431959,-113.464225
Alberta,Luigi's Concrete Ltd,"Sherwood Park, AB T8H 2J6",1,High Wage,7282,Concrete finishers,53.570997,-113.285306
Alberta,MAAN Transport Ltd.,"CALGARY, AB T3J 3Y8",1,High Wage,1215,"Supervisors, supply chain, tracking and scheduling co",51.108543,-113.925524
Alberta,Manchester Bottle Depot Ltd,"Calgary, AB T2G 1X4",1,High Wage,1215,"Supervisors, supply chain, tracking and scheduling co",51.0196616,-114.0572562
Alberta,MAPLE ROOFING INC.,"CALGARY, AB T2Y 0G2",2,High Wage,7291,Roofers and shinglers,50.909223,-114.123846
Alberta,Mariam's Footsteps Inc,"EDMONTON, AB T4S 1S5",6,High Wage,4212,Social and community service workers,52.321558,-114.11876
