British Columbia,Olympia Transportation Ltd,"Burnaby, BC V3N 2W1",1,High Wage,1215,"Supervisors, supply chain, tracking and scheduling co",49.192008,-122.962473
British Columbia,Omni Drywall Ltd.,"Surrey, BC V3S 1H9",4,High Wage,7271,Carpenters,49.157161,-122.764475
British Columbia,One Yoga Victoria Ltd,"VICTORIA, BC V8V 2G6",1,High Wage,5254,"Program leaders and instructors in recreation, sport and fitness",48.416639,-123.373091
British Columbia,Onikon Creative,"SURREY, BC V3R 4G8",1,High Wage,5241,Graphic designers and illustrators,49.1907915,-122.801026
British Columbia,Orbit Carpet Ltd,"Surrey, BC V3W 8J9",2,High Wage,6211,Retail sales supervisors,49.148317,-122.862175
British Columbia,Orbit Home Automation Ltd.,"SURREY, BC V3W 7B4",1,High Wage,2242,Electronic service technicians (household and business equipment),49.13003,-122.829659
British Columbia,Outbound Adventures Ltd,"Colwood, BC V9B 0J8",1,High Wage,0621,Retail and wholesale trade managers,48.488551,-123.49608
British Columbia,Oziss Industries Inc,"SURREY, BC V3W 4G1",1,High Wage,6211,Retail sales supervisors,49.157033,-122.868321
British Columbia,P and H Framing Ltd,"SURREY, BC V3T 3K1",2,High Wage,7611,Construction trades helpers and labourers,49.184849,-122.863178
British Columbia,P.C. Motors Inc.  o/a Peace Country Toyota,"DAWSON CREEK, BC V1G 3G9",1,High Wage,7321,"Automotive service technicians, truck and bus mechanics and mechanical repairers",55.742926,-120.225433
British Columbia,Paaraag Industrial Group Inc.,"Abbotsford, BC V2T 6H4",1,High Wage,0016,Senior managers ,49.050565,-122.379377
British Columbia,Pacific Link Education Centre Ltd,"SURREY, BC V3R 8X8",2,High Wage,1221,Administrative officers,49.184828,-122.80068
British Columbia,Pama Holdings Ltd. o/a Wild Wing,"SURREY, BC V3W 5A5",2,High Wage,6711,"Food counter attendants, kitchen helpers and related support occupations",49.129899,-122.84559
British Columbia,Pandher Painting Co.,"Surrey, BC V3X 3R1",1,High Wage,7294,Painters and decorators (except interior decorators),49.115767,-122.841719
British Columbia,Paper Excellence Canada Holdings Corporation,"Richmond, BC V6X 2W8",1,High Wage,2171,Information systems analysts and consultants,49.18667,-123.104869
British Columbia,Param Landscaping & Fencing Ltd.,"Vancouver, BC V5P 2Z1",2,High Wage,2225,Landscape and horticulture technicians and specialists,49.226908,-123.075885
British Columbia,Parastone Developments Ltd.,"Fernie, BC V0B 1M0",1,High Wage,7271,Carpenters,49.492372,-115.071785
British Columbia,Pattern Logistics Inc,"ABBOTSFORD, BC V2S 7T9",1,High Wage,1241,Administrative assistants,49.059838,-122.287117
British Columbia,Pay Less Hardwood Floors,"SURREY, BC V3S 7S7",1,High Wage,7295,Floor covering installers,49.0976815,-122.8012179
British Columbia,Pay Less Quality Doors Ltd.,"Surrey, BC V3W 3A6",1,High Wage,9227,"Supervisors, other products manufacturing and assembly",49.148251,-122.8698905
British Columbia,Payal Chat House Ltd.,"Vancouver, BC V5R 4V4",1,High Wage,6322,Cooks,49.2390321,-123.0352374
British Columbia,Payless Auto Towing Ltd.,"North Vancouver, BC V7J 3V8",1,High Wage,7305,"Supervisors, motor transport and other ground transit operators",49.310301,-123.0403723
British Columbia,Payless Paving Ltd,"LANGLEY, BC V2Z 3A6",1,High Wage,7302,"Contractors and supervisors, heavy equipment operator crews",49.048811,-122.559222
British Columbia,Payless Repairs Ltd.,"Abbotsford, BC V4X 1S8",1,High Wage,7321,"Automotive service technicians, truck and bus mechanics and mechanical repairers",49.0840437,-122.426022
British Columbia,PDQ Holdings Ltd. o/a Radium Super Mart,"RADIUM HOT SPRINGS, BC V0A 1M0",1,High Wage,6211,Retail sales supervisors,50.6224479675293,-116.071640014648
British Columbia,Peace River Ranch Ltd.,"DAWSON CREEK, BC V1G 2G4",1,High Wage,0015,Senior managers ,55.757002,-120.227183
British Columbia,Peace Way Trucking Ltd,"CHARLIE LAKE, BC V0C 1H0",1,High Wage,7237,Welders and related machine operators,56.2725,-120.945
British Columbia,PERFECT LINE PAINTING LTD.,"VANCOUVER, BC V6B 0P9",1,High Wage,7294,Painters and decorators (except interior decorators),49.2788687,-123.1197521
British Columbia,Persia Food Products Inc.,"NORTH VANCOUVER, BC V7M 1R5",1,High Wage,1311,Accounting technicians and bookkeepers,49.322104,-123.074769
British Columbia,Phoenix Homes (2011) Ltd,"SURREY, BC V3W 0K5",2,High Wage,7283,Tilesetters,49.155651,-122.879275
British Columbia,Planet India Restaurant Inc.,"SURREY, BC V3W 9Z1",2,High Wage,6322,Cooks,49.133685,-122.840478
British Columbia,Ponderosa Mushrooms,"Maple Ridge, BC V4R 2P7",1,High Wage,1221,Administrative officers,49.249465,-122.595183
British Columbia,Ponte Bros. Contracting Ltd,"Burnaby, BC V3N 4A4",3,High Wage,7271,Carpenters,49.244539,-122.910439
British Columbia,Posy's Fingers & Toes Spa Ltd,"Vancouver, BC V6Z 2R6",1,High Wage,6314,Customer and information services supervisors,49.273794,-123.1223645
British Columbia,Powerline Drywall Ltd.,"SURREY, BC V3S 4A2",1,High Wage,7205,"Contractors and supervisors, other construction trades, installers, repairers and servicers",49.1064689,-122.7421201
British Columbia,Powermax Automotive Corporation,"VANCOUVER, BC V7L 1A3",1,High Wage,7321,"Automotive service technicians, truck and bus mechanics and mechanical repairers",49.308517,-123.073458
British Columbia,Premium Fence Inc,"SURREY, BC V3S 8E5",2,High Wage,7271,Carpenters,49.097195,-122.701753
British Columbia,Prestige Irrigation System Ltd,"Richmond, BC V7A 5K3",2,High Wage,2225,Landscape and horticulture technicians and specialists,49.122623,-123.094229
British Columbia,Prime Packaging Company Ltd.,"RICHMOND, BC V6X  2A",1,High Wage,1225,Purchasing agents and officers,,
British Columbia,Primetals Technologies Austria GmbH,"VANCOUVER, BC V6C 3S7",1,High Wage,2132,Mechanical engineers,49.28739,-123.112827
British Columbia,Pro Body Shop (1998) Ltd o/a Fix Auto Salon Arm,"SALMON ARM, BC V1E 1S9",1,High Wage,7322,Motor vehicle body repairers,50.696653,-119.293455
British Columbia,Pro Max Trucking Ltd.,"Surrey, BC V3V 1J8",10,High Wage,7511,Transport truck drivers,49.170735,-122.867865
British Columbia,Professional Quality Construction Services Ltd,"SURREY, BC V3S 3T3",3,High Wage,6315,Cleaning supervisors,49.145469,-122.778804
British Columbia,Progressive Concrete (2007) Ltd.,"RICHMOND, BC V7C 1B5",2,High Wage,7282,Concrete finishers,49.170183,-123.176486
British Columbia,PTS Pacific Telemedicine Services,"WHITE ROCK, BC V4B 1E1",1,High Wage,0311,Managers in health care,49.0168937,-122.7901194
British Columbia,Purcell Heli-Skiing,"Golden, BC V0A 1H0",1,High Wage,5254,"Program leaders and instructors in recreation, sport and fitness",51.336188,-117.122118
British Columbia,Purifiers Cleaning Services Ltd,"Surrey, BC V3S 8A5",1,High Wage,0651,"Managers in customer and personal services, n.e.c.",49.126804,-122.802476
British Columbia,Quick Accounting Services Inc.,"Surrey, BC V3W 4C8",1,High Wage,1241,Administrative assistants,49.119295,-122.867891
British Columbia,Quick Electrical Ltd.,"SURREY, BC V3V 5P7",1,High Wage,7241,Electricians (except industrial and power system),49.16641,-122.856887
British Columbia,Quick Visa Immigration Services Ltd.,"SURREY, BC V3W 8R5",1,High Wage,1221,Administrative officers,49.1236136,-122.8609579
British Columbia,R & D Developments Ltd o/a Ramada Golden,"Golden, BC V0A 1H1",1,High Wage,1221,Administrative officers,51.326704,-116.979182
British Columbia,R & T Bottle Depot Ltd,"Abbotsford, BC V2T 4C6",1,High Wage,0621,Retail and wholesale trade managers,49.045989,-122.348395
British Columbia,R S Gill Express Ltd.,"Delta, BC V4G 1A5",1,High Wage,1221,Administrative officers,49.139884,-123.007934
British Columbia,Radio Holland Canada Inc,"VANCOUVER, BC V5M 1C2",1,High Wage,2241,Electrical and electronics engineering technologists and technicians,49.269633,-123.023668
British Columbia,Rai Express Lines Ltd,"Surrey, BC V3W 0M8",1,High Wage,1241,Administrative assistants,49.130845,-122.848267
British Columbia,Rai Medical Clinic,"Delta, BC V4E 2A8",1,High Wage,1311,Accounting technicians and bookkeepers,49.125712,-122.890797
British Columbia,Rai Plumbing Ltd.,"SURREY, BC V3S 0L2",5,High Wage,7251,Plumbers,49.091335,-122.875387
British Columbia,Rain Coast Plumbing & Heating Ltd,"Vancouver, BC V5X 1W1",2,High Wage,7251,Plumbers,49.217391,-123.091078
British Columbia,Rama Sweets & Restaurant Ltd,"Surrey, BC V3W 3M8",1,High Wage,6322,Cooks,49.1319205,-122.8903725
British Columbia,Rana Landscapers Ltd.,"VANCOUVER, BC V5X 2C5",1,High Wage,8255,"Contractors and supervisors, landscaping, grounds maintenance and horticulture services",49.214656,-123.080262
British Columbia,Ravi Hair Salon Limited,"DELTA, BC V4C 8H2",3,High Wage,6341,Hairstylists and barbers,49.135041,-122.909768
British Columbia,Ray Vedamani & Co. Inc.,"Delta, BC V4C 6S3",1,High Wage,1221,Administrative officers,49.175162,-122.890273
British Columbia,RCT Contracting Ltd,"Richmond, BC V7C 5J8",2,High Wage,7271,Carpenters,49.154556,-123.158774
British Columbia,Reach For The Stars Montessori Learning Academy Inc.,"BURNABY, BC V5H 4H7",1,High Wage,4214,Early childhood educators and assistants,49.228313,-123.008774
British Columbia,Regal Transport Ltd.,"Abbotsford, BC V2T 6Z4",15,High Wage,7511,Transport truck drivers,49.039186,-122.347871
British Columbia,Regal Window Fashions Ltd.,"PRINCE GEORGE, BC V2N 2P9",1,High Wage,7271,Carpenters,53.899763,-122.785779
British Columbia,Renaissance Enterprises Ltd. o/a Subway,"BURNABY, BC V5A 4Y6",1,High Wage,0631,Restaurant and food service managers,49.277799,-122.90916
British Columbia,RH Radiant Home,"NORTH VANCOUVER, BC V7M 2J5",3,High Wage,7384,"Other trades and related occupations, n.e.c.",49.323187,-123.07231
British Columbia,Ricky's Restaurant Walnut Grove,"Langley, BC V1M 2Y5",1,High Wage,1221,Administrative officers,49.1620697,-122.6566307
British Columbia,Ridge Valley Homes Ltd.,"Abbotsford, BC V2T 2R3",7,High Wage,7271,Carpenters,49.046868,-122.344972
British Columbia,Right Way Glass Ltd,"SURREY, BC V3S 2P6",2,High Wage,7292,Glaziers,49.158336,-122.80693
British Columbia,Riser Plumbing & Heating Ltd,"SURREY, BC V3V 1H1",1,High Wage,7251,Plumbers,49.169992,-122.873107
British Columbia,Rising Drywall & Construction Ltd,"SURREY, BC V3W 2L1",2,High Wage,7284,"Plasterers, drywall installers and finishers and lathers",49.131679,-122.828427
British Columbia,ROAM Adventures Inc.,"Nelson, BC V1L 4B7",2,High Wage,5254,"Program leaders and instructors in recreation, sport and fitness",49.4944768,-117.2945223
British Columbia,Rocket Trucking Inc.,"Abbotsford, BC V2T 5L4",6,High Wage,7511,Transport truck drivers,49.062772,-122.365501
British Columbia,Rolaas Drywall Construction Ltd,"Surrey, BC V3W 9N2",2,High Wage,7204,"Contractors and supervisors, carpentry trades",49.137642,-122.88292
British Columbia,Rolf Susi and Son Ltd.,"VANCOUVER, BC V6J 5M4",1,High Wage,7282,Concrete finishers,49.141519,-123.093146
British Columbia,Roop-Kala Jewellry and Saree House Ltd,"Surrey, BC V3W 1R1",1,High Wage,6211,Retail sales supervisors,49.150917,-122.86789
British Columbia,Round Wrap Industries Ltd.,"RICHMOND, BC V6V 3A9",1,High Wage,1221,Administrative officers,49.202942,-123.058021
British Columbia,RTC International Consulting Inc.,"Burnaby, BC V5H 2E4",1,High Wage,1123,"Professional occupations in advertising, marketing and public relations",49.225902,-122.991548
British Columbia,RTL Royal Terminal Logistics Inc,"Surrey, BC V3W 0V4",1,High Wage,1221,Administrative officers,49.130673,-122.870332
British Columbia,RV Drywall Ltd.,"SURREY, BC V3S 4P7",2,High Wage,7284,"Plasterers, drywall installers and finishers and lathers",49.131885,-122.824867
British Columbia,S & A Sandhu Enterprises Ltd.,"ABBOTSFORD, BC V4X 2M5",5,High Wage,7511,Transport truck drivers,49.0083465,-122.4040795
British Columbia,S & Co Enterprises Corp o/a Otaru Japanese Kitchen,"Richmond, BC V7C 5K1",1,High Wage,0631,Restaurant and food service managers,49.154088,-123.158768
British Columbia,S & S Framing Inc,"Surrey, BC V3R 7N3",1,High Wage,7271,Carpenters,49.167987,-122.817876
British Columbia,S.S. Uppal Trucking Ltd,"DELTA, BC V4K 4E2",1,High Wage,1215,"Supervisors, supply chain, tracking and scheduling co",49.159601,-122.932767
British Columbia,S2 Builders Ltd.,"FERNIE, BC V0B 1M2",1,High Wage,7271,Carpenters,49.500974,-115.058085
British Columbia,Saab Electric Ltd.,"SURREY, BC V3R 3V9",2,High Wage,7241,Electricians (except industrial and power system),49.168537,-122.813696
British Columbia,Sagarpur Holdings Ltd,"SURREY, BC V3X 1E2",1,High Wage,7204,"Contractors and supervisors, carpentry trades",49.113709,-122.834077
British Columbia,Sahota Drywall Ltd.,"SURREY, BC V3S 3M6",1,High Wage,7205,"Contractors and supervisors, other construction trades, installers, repairers and servicers",49.15365,-122.8014585
British Columbia,Saiish Enterprises Inc.o/a Husky Market,"Delta, BC V4C 6P4",2,High Wage,0621,Retail and wholesale trade managers,49.1738635,-122.8930325
British Columbia,Salvation Productions Inc,"Vancouver, BC V5M 2H5",1,High Wage,0111,Financial managers,49.261317,-123.028315
British Columbia,Samara Framing Ltd.,"SURREY, BC V3S 8S1",1,High Wage,7282,Concrete finishers,49.103255,-122.708519
British Columbia,San Industries Ltd.,"LANGLEY, BC V1M 3N8",1,High Wage,7311,Construction millwrights and industrial mechanics,49.161945,-122.523803
British Columbia,Sandman Media Inc.,"VANCOUVER, BC V6E 4G1",2,High Wage,2175,Web designers and developers,49.287924,-123.121584
British Columbia,Sangha Framing Ltd.,"Surrey, BC V3X 1L5",3,High Wage,7271,Carpenters,49.10965,-122.851829
British Columbia,Sangha Insulated Doors Ltd.,"Surrey, BC V3S 7A4",1,High Wage,1311,Accounting technicians and bookkeepers,49.163758,-122.791866
British Columbia,Santec Electric Inc.,"Vancouver, BC V5X 4V9",1,High Wage,2232,Mechanical engineering technologists and technicians,49.20877,-123.084397
British Columbia,Santokh Dulai Trucking Ltd.,"SURREY, BC V3W 3E8",4,High Wage,7511,Transport truck drivers,49.151983,-122.877117
British Columbia,Saron Enterprises Inc.  o/a Apollo Animal Hospital,"SURREY, BC V3S 1C4",1,High Wage,1241,Administrative assistants,49.104158,-122.737208
British Columbia,Satguru Foods Ltd.,"SURREY, BC V3W  1S",1,High Wage,0621,Retail and wholesale trade managers,,
British Columbia,Satnam Auto Service Ltd,"DELTA, BC V4C 3W1",1,High Wage,7321,"Automotive service technicians, truck and bus mechanics and mechanical repairers",49.176049,-122.89084
British Columbia,Seasons Business Services Corp,"VANCOUVER, BC V5Y 1C8",1,High Wage,1123,"Professional occupations in advertising, marketing and public relations",49.267833,-123.112388
British Columbia,Sen Pad Thai,"Vancouver, BC V6J 1M5",1,High Wage,6321,Chefs,49.266731,-123.066007
British Columbia,Seneca Building Maintenance Ltd,"SURREY, BC V3W  3A",1,High Wage,1241,Administrative assistants,,
British Columbia,Seoin Enterprises Ltd o/a Chosun Korean Restaurant,"Vancouver, BC V5R 5L6",1,High Wage,0631,Restaurant and food service managers,49.231953,-123.029974
British Columbia,Shawn Transport Ltd.,"Surrey, BC V3S 0T9",7,High Wage,7511,Transport truck drivers,49.139107,-122.810305
British Columbia,Shepherd Enterprises Ltd. o/a Pharmasave,"Surrey, BC V3X 1G1",1,High Wage,0621,Retail and wholesale trade managers,49.116271,-122.844962
British Columbia,Shine Construction Ltd,"SURREY, BC V3R 7K9",2,High Wage,7271,Carpenters,49.169246,-122.820726
British Columbia,Shonan Enterprises Inc. o/a Sushi Village,"Whistler, BC V0N 1B4",1,High Wage,6321,Chefs,50.113258,-122.94997
British Columbia,Shore Side Workforce Inc,"Richmond, BC V3V 2H1",1,High Wage,1223,Human resources and recruitment officers,49.179782,-122.887252
British Columbia,Sia General Contracting Ltd.,"RICHMOND, BC V6X 1P5",1,High Wage,5242,Interior designers and interior decorators,49.190253,-123.128014
British Columbia,Sigma Plumbing & Heating Inc,"SURREY, BC V3W 7H6",2,High Wage,7251,Plumbers,49.121622,-122.863182
British Columbia,Silky Touch Esthetics Ltd,"VANCOUVER, BC V5W 2Z4",1,High Wage,6211,Retail sales supervisors,49.234314,-123.090478
British Columbia,Singh Truck & Trailer Repair Ltd.,"Delta, BC V3M 5P7",1,High Wage,1311,Accounting technicians and bookkeepers,49.179545,-122.930144
British Columbia,SK Excavating Ltd.,"SURREY, BC V3S 0L2",1,High Wage,7302,"Contractors and supervisors, heavy equipment operator crews",49.091335,-122.875387
British Columbia,Sky Blue Transport Ltd.,"Abbotsford, BC V4X 2M4",8,High Wage,7511,Transport truck drivers,49.031805,-122.390616
British Columbia,Sky Nails Spa,"Surrey, BC V3S 9A5",1,High Wage,6314,Customer and information services supervisors,49.1046087,-122.8029151
British Columbia,Sky Tiles Ltd.,"SURREY, BC V3S 7Y9",2,High Wage,7283,Tilesetters,49.108278,-122.803227
British Columbia,SLICC Professional Services Ltd.,"Vancouver, BC V5M 1A4",1,High Wage,8255,"Contractors and supervisors, landscaping, grounds maintenance and horticulture services",49.269397,-123.052817
British Columbia,SLR Consulting (Canada) Ltd.,"Vancouver, BC V6J 1V4",1,High Wage,0212,Architecture and science managers,49.264623,-123.142885
British Columbia,Smarthomes Security Ltd.,"SURREY, BC V3W 5J6",1,High Wage,1241,Administrative assistants,49.133694,-122.834495
British Columbia,Snelson Canada Holdings Inc.,"VANCOUVER, BC V6C 2X8",1,High Wage,7302,"Contractors and supervisors, heavy equipment operator crews",49.285092,-123.119723
British Columbia,Solventek Inc.,"Burnaby, BC V5A 4V7",1,High Wage,0013,Senior managers ,49.259158,-122.9134395
British Columbia,Soo Management Inc.  o/a Sushi Nanaimo,"Vancouver, BC V5L 4R7",1,High Wage,0631,Restaurant and food service managers,49.281795,-123.056584
British Columbia,Source Concrete Pumping & Placing Ltd,"SURREY, BC V3Z 1B7",3,High Wage,7282,Concrete finishers,49.229809,-122.624224
British Columbia,South Asian Broadcasting Corporation Inc.,"SURREY, BC V3W 4G1",2,High Wage,5225,Audio and video recording technicians,49.157033,-122.868321
British Columbia,South Coast BC Transportation Authority,"New Westminster, BC V3L 0E7",1,High Wage,0016,Senior managers ,49.2209898,-122.8990775
British Columbia,South Hall Banquet & Wedding Palace,"Vancouver, BC V5X 4W1",2,High Wage,6321,Chefs,49.209215,-123.084023
British Columbia,SOVEREIGN MOTORS INC,"VANCOUVER, BC V6P 3T1",1,High Wage,7321,"Automotive service technicians, truck and bus mechanics and mechanical repairers",49.206107,-123.123557
British Columbia,Squamish Rafting Company Ltd.,"GARIBALDI HIGHLANDS, BC V0N 1T0",2,High Wage,5254,"Program leaders and instructors in recreation, sport and fitness",49.747509,-123.115243
British Columbia,SRT Diesel Truck & Trailer Repair Ltd,"ABBOTSFORD, BC V2S 7P2",1,High Wage,1241,Administrative assistants,49.033246,-122.287501
British Columbia,SSB Trucking Ltd.,"SURREY, BC V3W 3A5",1,High Wage,1215,"Supervisors, supply chain, tracking and scheduling co",49.1482575,-122.87465
British Columbia,Stampeder Motel,"Williams Lake, BC V2G 1B2",1,High Wage,6315,Cleaning supervisors,52.128423,-122.126927
British Columbia,Standard Fasteners Ltd.,"SURREY, BC V3W 0L6",1,High Wage,7232,Tool and die makers,49.1535327,-122.8807223
British Columbia,Standard Insulation & Siding Ltd.,"Surrey, BC V3W 8J9",1,High Wage,7293,Insulators,49.148317,-122.862175
British Columbia,Star Cabinet Doors Ltd.,"SURREY, BC V3W 3A4",1,High Wage,1221,Administrative officers,49.148449,-122.878136
British Columbia,Star Cafe Ltd.,"Richmond, BC V6Y 2V7",2,High Wage,6322,Cooks,49.170173,-123.140389
British Columbia,Stat Electrics Limited,"SURREY, BC V3W 2B8",2,High Wage,7241,Electricians (except industrial and power system),49.124221,-122.84807
British Columbia,Stealth Transport Ltd.,"Coquitlam, BC V3J 3Z4",1,High Wage,7511,Transport truck drivers,49.266464,-122.886189
British Columbia,Steven Le Notary Corporation,"Vancouver, BC V5P 3W2",1,High Wage,1242,Legal administrative assistants,49.233179,-123.065514
British Columbia,Stitches Creation Inc.,"Burnaby, BC V5J 5K4",1,High Wage,5241,Graphic designers and illustrators,49.2067467,-123.0197393
British Columbia,Sub4umanagement Ltd.,"Castlegar, BC V1N 1G8",1,High Wage,0631,Restaurant and food service managers,49.325513,-117.66559
British Columbia,Subway,"Abbotsford, BC V2S 7E6",1,High Wage,0631,Restaurant and food service managers,49.055037,-122.271714
British Columbia,Sulbing Korean Dessert Cafe Ltd,"BURNABY, BC V5A 3C2",1,High Wage,2175,Web designers and developers,49.256672,-122.9277
British Columbia,Summerfield Contracting Ltd,"SURREY, BC V3W 5G7",1,High Wage,7204,"Contractors and supervisors, carpentry trades",49.123314,-122.839921
British Columbia,Summit V Auto Ltd.,"CRANBROOK, BC V1C 3T1",1,High Wage,6314,Customer and information services supervisors,49.531875,-115.744739
British Columbia,SunFarm Products Ltd.,"VANCOUVER, BC V6C 1T2",1,High Wage,1222,Executive assistants,49.284648,-123.114909
British Columbia,Sunflex Windows and Doors Renovations Ltd.,"SURREY, BC V3W 6A7",1,High Wage,7271,Carpenters,49.1459184,-122.8297239
British Columbia,Suns Dental Laboratory Ltd.,"North Vancouver, BC V7J 2A2",1,High Wage,2253,Drafting technologists and technicians,49.33591,-123.040525
British Columbia,Super 4U Tent & Party Rental Ltd.,"Surrey, BC V3W 1B3",1,High Wage,7205,"Contractors and supervisors, other construction trades, installers, repairers and servicers",49.1555125,-122.8619615
British Columbia,Superbuild Industries Ltd,"Richmond, BC V7C 4V4",1,High Wage,1211,"Supervisors, general office and administrative support workers",49.170255,-123.151236
British Columbia,Supertech Designs Ltd,"Surrey, BC V3W 3X9",1,High Wage,9227,"Supervisors, other products manufacturing and assembly",49.127312,-122.807217
British Columbia,Surrey Centre Auto Repairs Inc,"Surrey, BC V3T 1W2",1,High Wage,7321,"Automotive service technicians, truck and bus mechanics and mechanical repairers",49.191472,-122.843789
British Columbia,Sushi 1.99 To Go Enterprises Ltd.,"COQUITLAM, BC V3K 3V8",1,High Wage,6322,Cooks,49.242766,-122.892434
British Columbia,Sushi 990 Ltd o/a Sushi 990,"Port Coquitlam, BC V3B 8B2",1,High Wage,6322,Cooks,49.2539698,-122.7420569
British Columbia,Sushi Island Japanese Restaurant,"Victoria, BC V8T 2C4",1,High Wage,6322,Cooks,48.444754,-123.335317
British Columbia,Sushi Town Restaurant (Coquitlam) Ltd.  o/a Sushi Town Japanese Restaurant,"Coquitlam, BC V3B 1C2",2,High Wage,6322,Cooks,49.277942,-122.8086
British Columbia,Sutco Contracting Ltd.,"Salmo, BC V0G 1Z0",10,High Wage,7511,Transport truck drivers,49.192908,-117.278312
British Columbia,SUTTON ROAD MARKING LTD.,"SURREY, BC V3Z 3X2",1,High Wage,7312,Heavy,49.230135,-122.620735
British Columbia,Sweeny Sarao Notary Corporation,"Surrey, BC V3W 1R1",1,High Wage,1242,Legal administrative assistants,49.150917,-122.86789
British Columbia,Sweet Cherubim Natural Foods Ltd.,"Vancouver, BC V5L 3X3",1,High Wage,0621,Retail and wholesale trade managers,49.274789,-123.069774
British Columbia,Swift Management Group BC Incorporated,"DELTA, BC V3M 5V8",1,High Wage,1123,"Professional occupations in advertising, marketing and public relations",49.167411,-122.943539
British Columbia,Takhar Drywall Ltd,"SURREY, BC V3S 3T1",2,High Wage,7284,"Plasterers, drywall installers and finishers and lathers",49.14066,-122.778785
British Columbia,Taraz Accounting Ltd,"NORTH VANCOUVER, BC V7M 2H1",1,High Wage,1221,Administrative officers,49.318604,-123.072437
British Columbia,T-Brothers Food & Trading Ltd.,"Coquitlam, BC V3K 6Z6",1,High Wage,1225,Purchasing agents and officers,49.225677,-122.849151
British Columbia,Team Building Maintenance Ltd.,"DELTA, BC V4C 3S3",2,High Wage,6315,Cleaning supervisors,49.1743875,-122.900497
British Columbia,Technicolor Canada Inc,"Vancouver, BC V6B 2S2",19,High Wage,5241,Graphic designers and illustrators,49.275012,-123.122465
British Columbia,TECHNI-CRAFT EQUIPMENT SERVICE LIMITED,"SURREY, BC V3Z 0P6",1,High Wage,7313,Refrigeration and air conditioning mechanics,49.06805,-122.780229
British Columbia,Teck Metals Ltd,"TRAIL, BC V1R 4S4",1,High Wage,2113,Geoscientists and oceanographers,49.099722,-117.695503
British Columbia,Teja Trucking Ltd.,"Abbotsford, BC V2T 0C4",1,High Wage,7321,"Automotive service technicians, truck and bus mechanics and mechanical repairers",49.0406065,-122.3535017
British Columbia,Teppan Village Steak House,"Whistler, BC V0N 1B4",2,High Wage,6321,Chefs,50.113258,-122.94997
British Columbia,Tesso Management Corp.,"NORTH VANCOUVER, BC V7N 1M3",1,High Wage,0632,Accommodation service managers,49.340228,-123.06584
British Columbia,TGC Financial Group Ltd.,"RICHMOND, BC V7B 0A2",1,High Wage,0013,Senior managers ,49.18611,-123.144537
British Columbia,Thandi Auto Care Centre Ltd.,"SURREY, BC V3W 3E8",1,High Wage,7321,"Automotive service technicians, truck and bus mechanics and mechanical repairers",49.151983,-122.877117
British Columbia,The Blackbird Barbershop Enterprises Ltd.,"VANCOUVER, BC V6C 2E8",1,High Wage,6341,Hairstylists and barbers,49.2858924,-123.116868
British Columbia,The Vanguard Method Consulting Limited,"VANCOUVER, BC V6B 0M3",1,High Wage,1122,Professional occupations in business management consulting,49.2807513,-123.1152712
British Columbia,The Well on Austin Health Group Inc.o/a The Well Medical Clinic,"Coquitlam, BC V3K 3N9",1,High Wage,1243,Medical administrative assistants,49.249174,-122.869313
British Columbia,Tiem Builders Ltd,"Port Coquitlam, BC V3C 2M7",2,High Wage,7233,Sheet metal workers,49.2415819,-122.7623394
British Columbia,Tiffany N.Y.Bridal,"Vancouver, BC V5K 2A7",1,High Wage,1241,Administrative assistants,49.280935,-123.025743
British Columbia,Time College Group Inc.,"RICHMOND, BC V6X 2C2",1,High Wage,1123,"Professional occupations in advertising, marketing and public relations",49.179775,-123.136543
