Manitoba,Speedy Singh Logistics Inc.,"WINNIPEG, MB R2C 4P3",10,High Wage,7511,Transport truck drivers
Manitoba,Square One World Media Inc.,"WINNIPEG, MB R3P 4G1",1,High Wage,5121,Authors and writers
Manitoba,"Tales From The Loop Productions, Ltd.","WINNIPEG, MB R2X 1G9",1,High Wage,5226,Other technical and co
Manitoba,The University of Manitoba,"Winnipeg, MB R3T 2N2",1,High Wage,0421,Administrators 
Manitoba,Trademark Logistics Inc,"WINNIPEG, MB R2M 1Z3",1,High Wage,1525,Dispatchers
Manitoba,Under the Hood Service Inc.,"WINNIPEG, MB R3T 2G7",1,High Wage,0621,Retail and wholesale trade managers
Manitoba,Western Canadian Aerial Ltd,"Minnedosa, MB R0J 1E0",4,High Wage,2271,"Air pilots, flight engineers and flying instructors"
Manitoba,White Lotus Canine Social Club Ltd,"WINNIPEG, MB R3C 3H3",1,High Wage,0651,"Managers in customer and personal services, n.e.c."
Manitoba,4871333 Manitoba Ltd.  o/a Subway,"WINNIPEG, MB R3Y 0N1",1,4871333 Manitoba Ltd.  o/a Subway,6311,Food service supervisors
Manitoba,5030749 Manitoba Ltd. o/a Amaranth Inn,"Amaranth, MB R0H 0B0",1,Low Wage,6513,Food and beverage servers
Manitoba,5585032 Manitoba Ltd. o/a Pizza Pizza,"Winnipeg, MB R3T 2H5",1,Low Wage,0631,Restaurant and food service managers
Manitoba,6482610 Manitoba Ltd,"WINNIPEG, MB R3Y 1N6",1,Low Wage,6562,"Estheticians, electrologists and related occupations"
Manitoba,6802312 Manitoba Inc.,"MORRIS, MB R0G 1K0",2,Low Wage,6711,"Food counter attendants, kitchen helpers and related support occupations"
Manitoba,7024207 Canada Ltd,"Virden, MB R0M 2C0",1,Low Wage,6711,"Food counter attendants, kitchen helpers and related support occupations"
Manitoba,7107404 Manitoba Ltd. o/a Ashern Foods,"ASHERN, MB R0C 0E0",1,Low Wage,6211,Retail sales supervisors
Manitoba,7207621 Manitoba Ltd o/a Shop Easy Foods,"SAINT CLAUDE, MB R0G 1Z0",1,Low Wage,6331,"Butchers, meat cutters and fishmongers "
Manitoba,7386428 Manitoba Ltd. o/a Subway,"ARBORG, MB R0C 0A0",1,Low Wage,6311,Food service supervisors
Manitoba,7540150 Manitoba Ltd.,"KILLARNEY, MB R0K 1G0",1,Low Wage,6322,Cooks
Manitoba,Ashkrish Inc. o/a Subway,"MORRIS, MB R0G 1K0",2,Low Wage,6311,Food service supervisors
Manitoba,Baexim International Inc o/a Grand Rapids Esso,"Grand Rapids, MB R0C 1E0",1,Low Wage,6322,Cooks
Manitoba,Double Double Cathy Ltd.,"WINNIPEG, MB R3R 0A5",1,Low Wage,0631,Restaurant and food service managers
Manitoba,Olive Green Investments Inc. o/a Canadian Tire,"Flin Flon, MB R8A 0C6",2,Low Wage,6211,Retail sales supervisors
Manitoba,Redcap Enterprise Company Ltd. o/a Shoal Lake Motor Inn,"Shoal Lake, MB R0J 1Z0",1,Low Wage,6322,Cooks
Manitoba,Shiv Shakti Anpurna Ltd. o/a Boston Pizza,"Dauphin, MB R7N 3H4",1,Low Wage,6322,Cooks
Manitoba,Stifado Holdings Ltd. o/a Tim Horton's,"DAUPHIN, MB R7N 3J5",2,Low Wage,6311,Food service supervisors
Manitoba,Wonder Shows Ltd,"WINNIPEG, MB R2C 2Z2",10,Low Wage,6722,"Operators and attendants in amusement, recreation and sport"
Manitoba,3012352 Manitoba Ltd,"Roblin, MB R0L 1P0",12,3012352 Manitoba Ltd,8252,"Agricultural service contractors, farm supervisors and specialized livestock workers"
Manitoba,3120180 Manitoba Ltd,"RUSSELL, MB R0J 1W0",2,Primary Agriculture,8432,Nursery and greenhouse workers
Manitoba,4647204 Manitoba Ltd,"Austin, MB R0H 0C0",2,Primary Agriculture,8431,General farm workers
Manitoba,4663943 Manitoba Ltd.,"Minnedosa, MB R0J 1E0",2,Primary Agriculture,8431,General farm workers
Manitoba,71844 Manitoba Ltd o/a Podolski Honey Farms,"Ethelbert, MB R0L 0T0",8,Primary Agriculture,8431,General farm workers
Manitoba,Abtshof Farms Ltd.,"ELIE, MB R0H 0H0",1,Primary Agriculture,8252,"Agricultural service contractors, farm supervisors and specialized livestock workers"
Manitoba,Agassiz Seed Farm Ltd.,"HOMEWOOD, MB R0G 0Y0",1,Primary Agriculture,8431,General farm workers
Manitoba,AJC Fergusson Farms Ltd.,"ALEXANDER, MB R0K 0A0",1,Primary Agriculture,8252,"Agricultural service contractors, farm supervisors and specialized livestock workers"
Manitoba,Aletta Holsteins Inc.,"Linden, MB R0A 0X1",1,Primary Agriculture,8252,"Agricultural service contractors, farm supervisors and specialized livestock workers"
Manitoba,Anpo Natural Tannery & Ranch,"ROSSBURN, MB R0J 1V0",1,Primary Agriculture,8431,General farm workers
Manitoba,Ash Apiaries Ltd.,"Gilbert Plains, MB R0L 0X0",13,Primary Agriculture,8431,General farm workers
Manitoba,Aubin Nurseries Ltd.,"Carman, MB R0G 0J0",5,Primary Agriculture,8432,Nursery and greenhouse workers
Manitoba,Bee Blossom Apiaries Ltd,"Gilbert Plains, MB R0L 0X0",3,Primary Agriculture,8431,General farm workers
Manitoba,Busy Bee Apiaries Ltd,"Austin, MB R0H 0C0",7,Primary Agriculture,8431,General farm workers
Manitoba,Canmark Family Farming Ltd.,"Roblin, MB R0L 1P0",1,Primary Agriculture,8431,General farm workers
Manitoba,Connery's Riverdale Farms Ltd,"Portage La Prairie, MB R1N 3B2",51,Primary Agriculture,8431,General farm workers
Manitoba,Corduroy Plains Ltd,"Carman, MB R0G 0J0",4,Primary Agriculture,8431,General farm workers
Manitoba,Crocus Country Pork,"Cartwright, MB R0K 0L0",1,Primary Agriculture,8252,"Agricultural service contractors, farm supervisors and specialized livestock workers"
Manitoba,Crocus Swine Inc.,"BRUNKILD, MB R0G 0E0",2,Primary Agriculture,8252,"Agricultural service contractors, farm supervisors and specialized livestock workers"
Manitoba,Drul Farms Ent,"OAKBURN, MB R0J 1L0",1,Primary Agriculture,8431,General farm workers
Manitoba,Dufferin Market Gardens Ltd,"Carman, MB R0G 0J0",18,Primary Agriculture,8431,General farm workers
Manitoba,Dykun Farms Ltd,"Gilbert Plains, MB R0L 0X0",1,Primary Agriculture,8252,"Agricultural service contractors, farm supervisors and specialized livestock workers"
Manitoba,Friedensfeld Honey & Berry Farm Ltd.,"Steinbach, MB R5G 1M4",4,Primary Agriculture,8431,General farm workers
Manitoba,Grysiuk Apiary Inc.,"Winnipeg, MB R2Y 2E8",6,Primary Agriculture,8431,General farm workers
Manitoba,Grysiuk Honey Farms Ltd.,"Winnipeg, MB R2Y 0P8",9,Primary Agriculture,8431,General farm workers
Manitoba,Gusta Sod Farms,"Stead, MB R0E 1Z0",4,Primary Agriculture,8431,General farm workers
Manitoba,Hammond Agriculture Limited,"Roblin, MB R0L 1P0",1,Primary Agriculture,0821,Managers in agriculture
Manitoba,Horsemens Benevolent And Protective Association Of Manitoba Inc.,"Winnipeg, MB R3K 2E9",3,Primary Agriculture,8252,"Agricultural service contractors, farm supervisors and specialized livestock workers"
Manitoba,Interlake Honey Producers Ltd.,"Fisher Branch, MB R0C 0Z0",4,Primary Agriculture,8431,General farm workers
Manitoba,Itzke River Farm Ltd,"Marquette, MB R0H 0V0",98,Primary Agriculture,8431,General farm workers
Manitoba,JDD Farms Ltd.,"Gilbert Plains, MB R0L 0X0",1,Primary Agriculture,8431,General farm workers
Manitoba,Jeffries Bros Vegetable Growers Inc.,"Portage la Prairie, MB R1N 3C2",22,Primary Agriculture,8431,General farm workers
Manitoba,Jeffries Nurseries Ltd.,"PORTAGE LA PRAIRIE, MB R1N 3B7",15,Primary Agriculture,8432,Nursery and greenhouse workers
Manitoba,Kroeker Farms Limited,"Winkler, MB R6W 0K7",62,Primary Agriculture,8431,General farm workers
Manitoba,Lewis and Sons Enterprises Ltd,"Austin, MB R0H 0C0",2,Primary Agriculture,8431,General farm workers
Manitoba,Loe-Bee Honey Farms Ltd.,"STE. ANNE, MB R5H 1R1",6,Primary Agriculture,8431,General farm workers
Manitoba,Martin Farms Ltd.,"EAST SELKIRK, MB R0E 0M0",1,Primary Agriculture,8431,General farm workers
Manitoba,Mayfair Farms (Portage) Ltd,"Portage La Prairie, MB R1N 3B2",1,Primary Agriculture,8431,General farm workers
Manitoba,Meyer Farms Co. Ltd.,"Cartier, MB R4K 1B1",4,Primary Agriculture,8431,General farm workers
Manitoba,Nichol Honey Farm Ltd.,"MacGregor, MB R0H 0R0",12,Primary Agriculture,8431,General farm workers
Manitoba,OakNook Honey Products Ltd.,"Ashville, MB R0L 0A0",18,Primary Agriculture,8431,General farm workers
Manitoba,Riedbow Dairy Ltd.,"Elm Creek, MB R0G 0N0",3,Primary Agriculture,8252,"Agricultural service contractors, farm supervisors and specialized livestock workers"
Manitoba,Schriemer Family Farm,"OTTERBURNE, MB R0A 1G0",1,Primary Agriculture,8431,General farm workers
Manitoba,Superior Weanlings Ltd.,"Birtle, MB R0M 0C0",1,Primary Agriculture,8252,"Agricultural service contractors, farm supervisors and specialized livestock workers"
Manitoba,W.F. Farms Ltd.,"Portage La Prairie, MB R1N 3A4",4,Primary Agriculture,8431,General farm workers
Manitoba,Waldbee Honey Farms Inc.,"EAST SELKIRK, MB R0E 0M0",1,Primary Agriculture,8252,"Agricultural service contractors, farm supervisors and specialized livestock workers"
Manitoba,West 10 Honey Ltd.,"Ethelbert, MB R0L 0T0",9,Primary Agriculture,8252,"Agricultural service contractors, farm supervisors and specialized livestock workers"
Manitoba,WJ Siemens Farming Co.,"WINKLER, MB R6W 4B7",4,Primary Agriculture,8431,General farm workers
Manitoba,SkipTheDishes Restaurant Services,"WINNIPEG, MB R3B 0P4",3,SkipTheDishes Restaurant Services,2171,Information systems analysts and consultants
Manitoba,Standard Aero Limited,"WINNIPEG, MB R3H 1A1",1,Global Talent Stream,0016,Senior managers 
Saskatchewan,101168437 Saskatchewan Ltd. o/a 29th Street Market,"BATTLEFORD, SK S0M 0E0",1,101168437 Saskatchewan Ltd. o/a 29th Street Market,6211,Retail sales supervisors
Saskatchewan,101243905 Saskatchewan Ltd,"LANGENBURG, SK S0A 2A0",1,High Wage,6731,Light duty cleaners
Saskatchewan,101281048 Saskatchewan Ltd.,"North Battleford, SK S9A 3C3",1,High Wage,6711,"Food counter attendants, kitchen helpers and related support occupations"
Saskatchewan,102006469 Saskatchewan Corp o/a Bel Air Gardens Restaurant,"MAPLE CREEK, SK S0N 1N0",1,High Wage,6322,Cooks
Saskatchewan,1944831 Alberta Ltd.,"PIERCELAND, SK S0M 2K0",1,High Wage,6211,Retail sales supervisors
Saskatchewan,"3D Entertainment Group,Inc.","SASKATOON, SK S7W 1B9",1,High Wage,5232,"Other performers, n.e.c."
Saskatchewan,Bergen Excavating Ltd,"White City, SK S4L 0B7",4,High Wage,7282,Concrete finishers
Saskatchewan,Birmingham's Transport Ltd,"Regina, SK S4N 1L4",2,High Wage,7511,Transport truck drivers
Saskatchewan,Bullet Express Inc.,"Regina, SK S4W 0G7",2,High Wage,7511,Transport truck drivers
Saskatchewan,Clayton Air Service Ltd,"LEASK, SK S0J 1M0",6,High Wage,2271,"Air pilots, flight engineers and flying instructors"
Saskatchewan,Hope Clinic on 5th,"Saskatoon, SK S7K 2P2",1,High Wage,3111,Specialist physicians
Saskatchewan,MacNeil Motors Inc.,"MARTENSVILLE, SK S0K 2T0",1,High Wage,0621,Retail and wholesale trade managers
Saskatchewan,Midfield Enterprises Ltd. o/a Battlefords Airspray,"North Battleford, SK S9A 3L8",2,High Wage,2271,"Air pilots, flight engineers and flying instructors"
Saskatchewan,Moose Jaw Cardiac Centre,"Moose Jaw, SK S6H 0W2",1,High Wage,3111,Specialist physicians
Saskatchewan,Natfil Enterprises Inc,"Regina, SK S4W 0C5",4,High Wage,7511,Transport truck drivers
Saskatchewan,Potzus Paving & Road Maintenance Ltd.,"Yorkton, SK S3N 2X1",1,High Wage,7302,"Contractors and supervisors, heavy equipment operator crews"
Saskatchewan,S R L Transport,"Saskatoon, SK S7P 0C8",1,High Wage,1221,Administrative officers
Saskatchewan,Sky Ag Services Limited,"Lafleche, SK S0H 2K0",1,High Wage,2271,"Air pilots, flight engineers and flying instructors"
Saskatchewan,SNLM Dental Prof. Corp.,"REGINA, SK S4P 4K9",1,High Wage,0014,Senior managers 
Saskatchewan,Sohang Transportation Ltd,"REGINA, SK S4X 0L8",3,High Wage,7511,Transport truck drivers
Saskatchewan,Vicki's on 1 Family Restaurant Limited,"GRENFELL, SK S0G 2B0",2,High Wage,6513,Food and beverage servers
Saskatchewan,101163175 Sask Ltd.,"WATROUS, SK S0K 4T0",2,101163175 Sask Ltd.,6731,Light duty cleaners
Saskatchewan,101305878 Saskatchewan Ltd,"REGINA, SK S4S 3C5",1,Low Wage,0631,Restaurant and food service managers
Saskatchewan,102011228 Saskatchewan Inc. o/a Western Pizza,"REGINA, SK S4R 5R4",1,Low Wage,6311,Food service supervisors
Saskatchewan,10245997 Saskatchewan Ltd.,"SASKATOON, SK S7N 1B3",1,Low Wage,6322,Cooks
Saskatchewan,Bonobene Enterprise Ltd,"Emerald Park, SK S4L 0B8",1,Low Wage,6322,Cooks
Saskatchewan,Calling Hills Enterprises Ltd. o/a Dairy Queen,"Fort Qu'Appelle, SK S0G 1S0",3,Low Wage,6711,"Food counter attendants, kitchen helpers and related support occupations"
Saskatchewan,Caraway Grill Ltd o/a Caraway Grill,"Regina, SK S4P 1X3",1,Low Wage,6322,Cooks
Saskatchewan,Flavours of India Restaurant & Sweets Inc.,"REGINA, SK S4N 0N6",2,Low Wage,6322,Cooks
Saskatchewan,Grand Liquor & Grocery Ltd.,"Indian Head, SK S0G 2K0",1,Low Wage,6211,Retail sales supervisors
Saskatchewan,Han Chang Investment Corporation o/a Carra Valla Inn,"Melfort, SK S0E 1A0",1,Low Wage,6312,Executive housekeepers
Saskatchewan,Hashtag International Inc,"SASKATOON, SK S7K 8C1",1,Low Wage,6211,Retail sales supervisors
Saskatchewan,J & J Value Properties Ltd. o/a Centennial Motel,"Kindersley, SK S0L 1S0",1,Low Wage,6313,"Accommodation, travel, tourism and related services supervisors"
Saskatchewan,Kindersley Hi-Ho Gas & Wash Ltd.,"Kindersley, SK S0L 1S0",1,Low Wage,6211,Retail sales supervisors
Saskatchewan,La Ronge Native Women's Council Family Service Centre,"LA RONGE, SK S0J 1L0",1,Low Wage,4212,Social and community service workers
Saskatchewan,Old Sonny Boy Enterprises Ltd o/a Esso,"CHAMBERLAIN, SK S0G 0R0",1,Low Wage,6711,"Food counter attendants, kitchen helpers and related support occupations"
Saskatchewan,Panda Davidson Restaurant,"Davidson, SK S0G 1A0",1,Low Wage,6322,Cooks
Saskatchewan,Royal Hotel,"Strasbourg, SK S0G 4V0",1,Low Wage,6731,Light duty cleaners
Saskatchewan,Shin & Lee Enterprises Ltd o/a Birch Tree Cafe,"Birch Hills, SK S0J 0G0",1,Low Wage,6322,Cooks
Saskatchewan,Skyway Brands Regina Inc.  o/a Skyway Grill,"REGINA, SK S4W 1B3",1,Low Wage,0631,Restaurant and food service managers
Saskatchewan,Star House Enterprises Ltd. o/a Star House Family Restaurant,"Prince Albert, SK S6V 5G1",1,Low Wage,6322,Cooks
Saskatchewan,Walia Management Ltd. o/a Subway,"Melfort, SK S0E 1A0",1,Low Wage,6311,Food service supervisors
Saskatchewan,101008187 Saskatchewan Ltd.,"Wadena, SK S0A 4J0",2,101008187 Saskatchewan Ltd.,8431,General farm workers
Saskatchewan,101026263 Saskatchewan Ltd.,"PORCUPINE PLAIN, SK S0E 1H0",3,Primary Agriculture,8431,General farm workers
Saskatchewan,101034244 Saskatchewan Ltd,"LANGENBURG, SK S0A 2A0",1,Primary Agriculture,8252,"Agricultural service contractors, farm supervisors and specialized livestock workers"
Saskatchewan,Althouse Honey Farms Inc.,"PORCUPINE PLAIN, SK S0E 1H0",6,Primary Agriculture,8431,General farm workers
Saskatchewan,B Strong Apiaries Limited,"Rocanville, SK S0A 3L0",10,Primary Agriculture,8431,General farm workers
Saskatchewan,Bacon Apiaries Ltd.,"Kinistino, SK S0J 1H0",1,Primary Agriculture,8431,General farm workers
Saskatchewan,Baconian Bee Farm Ltd.,"Kinistino, SK S0J 1H0",3,Primary Agriculture,8431,General farm workers
Saskatchewan,Birch Creek Farms Ltd.,"Wadena, SK S0A 4J0",1,Primary Agriculture,8431,General farm workers
Saskatchewan,Bowker Acres Inc.,"UNITY, SK S0K 4L0",1,Primary Agriculture,8431,General farm workers
Saskatchewan,Brent Kittelson Harvesting Ltd.,"BROMHEAD, SK S0C 0N0",3,Primary Agriculture,8431,General farm workers
Saskatchewan,B's Bee Ranch Inc.,"Kinistino, SK S0J 1H0",5,Primary Agriculture,8431,General farm workers
Saskatchewan,CANA Farms Inc.,"QU'APPELLE, SK S0G 4A0",1,Primary Agriculture,8252,"Agricultural service contractors, farm supervisors and specialized livestock workers"
Saskatchewan,CHB Farms Ltd.,"Dundurn, SK S0K 1K0",2,Primary Agriculture,8431,General farm workers
Saskatchewan,Craven Riverside Gardens Inc,"Craven, SK S0G 0W0",10,Primary Agriculture,8431,General farm workers
Saskatchewan,Dietrich Farms Ltd.,"Mendham, SK S0N 1P0",5,Primary Agriculture,8431,General farm workers
Saskatchewan,Donahue Commodities Ltd,"BIGGAR, SK S0K 0M0",3,Primary Agriculture,8431,General farm workers
Saskatchewan,Duane Forrester Properties Inc.,"Torquay, SK S0C 2L0",3,Primary Agriculture,8431,General farm workers
Saskatchewan,Dutch Growers Garden Center Ltd,"SASKATOON, SK S7N 2Z9",5,Primary Agriculture,8432,Nursery and greenhouse workers
Saskatchewan,ESKDALE ACRES INC.,"LEROSS, SK S0A 2C0",2,Primary Agriculture,8252,"Agricultural service contractors, farm supervisors and specialized livestock workers"
Saskatchewan,Etomami Organics Ltd.,"Hudson Bay, SK S0E 0Y0",2,Primary Agriculture,8431,General farm workers
Saskatchewan,Fedoruk Farms Inc.,"Kamsack, SK S0A 1S0",1,Primary Agriculture,8431,General farm workers
Saskatchewan,Frederick Farms Ltd,"WATSON, SK S0K 4V0",6,Primary Agriculture,8431,General farm workers
Saskatchewan,G & B Friesen Farms Ltd,"Quill Lake, SK S0A 3E0",4,Primary Agriculture,8431,General farm workers
Saskatchewan,G Double Bar Farms Ltd.,"Borden, SK S0K 0N0",1,Primary Agriculture,8431,General farm workers
Saskatchewan,G.C. Jensen Acres Inc.,"MILDEN, SK S0L 2L0",2,Primary Agriculture,8431,General farm workers
Saskatchewan,Glendenning Honey Farms Ltd.,"Pleasantdale, SK S0K 3H0",9,Primary Agriculture,8431,General farm workers
Saskatchewan,Golden West Enterprises,"Saskatoon, SK S7N 0J9",6,Primary Agriculture,8431,General farm workers
Saskatchewan,Hannigan Honey Inc,"Shellbrook, SK S0J 2E0",16,Primary Agriculture,8431,General farm workers
Saskatchewan,Hawarden Hills Farms Ltd.,"OUTLOOK, SK S0L 2N0",1,Primary Agriculture,8431,General farm workers
Saskatchewan,HERLE SEED FARM LTD.,"WILKIE, SK S0K 4W0",1,Primary Agriculture,8431,General farm workers
Saskatchewan,Hilbert Honey Co Ltd,"Humboldt, SK S0K 2A0",11,Primary Agriculture,8431,General farm workers
Saskatchewan,Hire Yield Ag Solutions Inc.,"Arcola, SK S0C 0G0",2,Primary Agriculture,8431,General farm workers
Saskatchewan,Janeil Enterprises Inc,"Eatonia, SK S0L 0Y0",4,Primary Agriculture,8431,General farm workers
Saskatchewan,Janzen Honey Farms,"Carrot River, SK S0E 0L0",4,Primary Agriculture,8431,General farm workers
Saskatchewan,Keatco Farms Ltd.,"Pennant Station, SK S0N 1X0",3,Primary Agriculture,8431,General farm workers
Saskatchewan,Knudsen's Honey Inc.,"Porcupine Lake, SK S0E 1H0",4,Primary Agriculture,8431,General farm workers
Saskatchewan,Lacasse Farms Ltd.,"Kincaid, SK S0H 2J0",2,Primary Agriculture,8431,General farm workers
Saskatchewan,Land & Sky Grains Inc.,"GRENFELL, SK S0G 3B0",1,Primary Agriculture,8431,General farm workers
Saskatchewan,Lazy Y Grain & Cattle Ltd,"Mossbank, SK S0H 3G0",1,Primary Agriculture,8431,General farm workers
Saskatchewan,LeBras Farms Ltd,"ARBORFIELD, SK S0E 0A1",2,Primary Agriculture,8431,General farm workers
Saskatchewan,Lincoln Gardens 06,"Lumsden, SK S0G 3C0",8,Primary Agriculture,8431,General farm workers
Saskatchewan,Meadow Ridge Enterprises Ltd,"SASKATOON, SK S7K 3J9",8,Primary Agriculture,8431,General farm workers
Saskatchewan,Michaelsen Farms,"Lampman, SK S0C 1N0",3,Primary Agriculture,8431,General farm workers
Saskatchewan,Millstone Farm Ltd.,"Speers, SK S0M 2V0",2,Primary Agriculture,8252,"Agricultural service contractors, farm supervisors and specialized livestock workers"
Saskatchewan,Monette Farms Ltd.,"Swift Current, SK S9H 3X4",4,Primary Agriculture,8252,"Agricultural service contractors, farm supervisors and specialized livestock workers"
Saskatchewan,Moyen Honey Farm,"Zenon Park, SK S0E 1W0",10,Primary Agriculture,8431,General farm workers
Saskatchewan,Neekinan Farms Ltd.,"LAPORTE, SK S0L 1W0",1,Primary Agriculture,8252,"Agricultural service contractors, farm supervisors and specialized livestock workers"
Saskatchewan,Olynorth Farms LP,"Humboldt, SK S0K 2A0",9,Primary Agriculture,8252,"Agricultural service contractors, farm supervisors and specialized livestock workers"
Saskatchewan,PCROSS RANCH LTD.,"BIGGAR, SK S0K 0M0",2,Primary Agriculture,8431,General farm workers
Saskatchewan,PDRA Ackerman Acres Ltd.,"CHAMBERLAIN, SK S0G 0R0",1,Primary Agriculture,8431,General farm workers
Saskatchewan,Pedigree Poultry Ltd.,"Regina Beach, SK S0G 4C0",6,Primary Agriculture,8431,General farm workers
Saskatchewan,Prairie Berries Inc.,"KEELER, SK S0H 2E0",10,Primary Agriculture,8431,General farm workers
Saskatchewan,Richards Family Farm & Livestock Ltd,"BANGOR, SK S0A 0E0",1,Primary Agriculture,8252,"Agricultural service contractors, farm supervisors and specialized livestock workers"
Saskatchewan,Ridgedale Co-op Association Ltd,"Ridgedale, SK S0E 1L0",10,Primary Agriculture,8431,General farm workers
Saskatchewan,Riley Campbell Farms Inc,"Caronport, SK S0H 0S0",2,Primary Agriculture,8431,General farm workers
Saskatchewan,Shamrock Ranch Ltd,"SHAMROCK, SK S0H 3W0",1,Primary Agriculture,8252,"Agricultural service contractors, farm supervisors and specialized livestock workers"
Saskatchewan,Singer Enterprises Inc,"BIGGAR, SK S0R 0M0",1,Primary Agriculture,8252,"Agricultural service contractors, farm supervisors and specialized livestock workers"
Saskatchewan,SJBeeZ,"Melfort, SK S0E 1A0",6,Primary Agriculture,8431,General farm workers
Saskatchewan,Sommer Green Forages Inc,"Broderick, SK S0H 0L0",1,Primary Agriculture,8431,General farm workers
Saskatchewan,Spring Creek Garden Ltd,"OUTLOOK, SK S0L 2N0",27,Primary Agriculture,8431,General farm workers
Saskatchewan,The Berry Barn,"Saskatoon, SK S7K 3J6",3,Primary Agriculture,8432,Nursery and greenhouse workers
Saskatchewan,Valleau Apiaries Ltd,"Aylsham, SK S0E 0C0",13,Primary Agriculture,8431,General farm workers
Saskatchewan,Vision Farms Corp,"Weyburn, SK S4H 3N8",1,Primary Agriculture,8252,"Agricultural service contractors, farm supervisors and specialized livestock workers"
Saskatchewan,Wood Bros. Apiaries Inc.,"Melfort, SK S0E 1A0",5,Primary Agriculture,8431,General farm workers
Saskatchewan,Wrigley Farms Ltd,"Arborfield, SK S0E 0A0",2,Primary Agriculture,8431,General farm workers
Saskatchewan,Yves Garez Honey Inc,"Nipawin, SK S0E 1E0",14,Primary Agriculture,8431,General farm workers
Saskatchewan,Zosel Tree Farm,"Pleasantdale, SK S0K 3H0",3,Primary Agriculture,8432,Nursery and greenhouse workers
Saskatchewan,Custom Agricultural Intelligence Inc.,"SEDLEY, SK S0K 4K0",1,Custom Agricultural Intelligence Inc.,9212,"Supervisors, petroleum, gas and chemical processing and utilities"
Saskatchewan,Pivot Furniture Technologies Inc.,"SASKATOON, SK S7N 0J5",1,Global Talent Stream,2173,Software engineers and designers
Alberta,0887245 BC Ltd o/a The Mango Tree,"RED DEER, AB T4N 1K9",1,0887245 BC Ltd o/a The Mango Tree,6311,Food service supervisors
Alberta,1005364 Alberta Ltd,"LETHBRIDGE, AB T1K 5R9",1,High Wage,6311,Food service supervisors
Alberta,1007011 Alberta Ltd. o/a Burger Baron,"Edmonton, AB T6E 0V7",1,High Wage,6311,Food service supervisors
Alberta,1027855 Alberta Ltd o/a B & B Dhaliwal Trucking,"Edmonton, AB T6T 0B3",4,High Wage,7511,Transport truck drivers
Alberta,1036302 Alberta Ltd,"EDMONTON, AB T6E 5X5",1,High Wage,7535,Other automotive mechanical installers and servicers
Alberta,1080472 Alberta Ltd,"Edmonton, AB T5J 0A3",1,High Wage,6311,Food service supervisors
Alberta,1105652 Alberta Inc,"EDMONTON, AB T6C 3V5",1,High Wage,8255,"Contractors and supervisors, landscaping, grounds maintenance and horticulture services"
Alberta,1157049 Alberta Ltd o/a Best Western Airdrie,"Airdrie, AB T4B 1S2",1,High Wage,0714,Facility operation and maintenance managers
Alberta,1164797 Alberta Ltd o/a Shan Trucking,"EDMONTON, AB T6P 1S1",2,High Wage,7535,Other automotive mechanical installers and servicers
Alberta,1199213 Alberta Ltd,"GRANDE PRAIRIE, AB T8V 6J6",1,High Wage,6211,Retail sales supervisors
Alberta,1205705 Alberta Ltd o/a Joey's Restaurant,"Calgary, AB T3E 3C8",1,High Wage,0631,Restaurant and food service managers
Alberta,1207320 Alberta Ltd,"Calgary, AB T3J 0J1",5,High Wage,7282,Concrete finishers
Alberta,1293959 Alberta Ltd,"Lamont, AB T0B 2R0",1,High Wage,6322,Cooks
Alberta,1296954 Alberta Ltd.,"EDMONTON, AB T6W 2Z8",2,High Wage,6322,Cooks
Alberta,1303886 Alberta Ltd o/a East Side,"Slave Lake, AB T0G 2A3",1,High Wage,6211,Retail sales supervisors
Alberta,1310115 Alberta Ltd,"EDMONTON, AB T5V 0A4",1,High Wage,1525,Dispatchers
Alberta,1327138 Alberta Ltd. o/a Astro Dental Art,"CALGARY, AB T2N 3N5",2,High Wage,3223,"Dental technologists, technicians and laboratory assistants"
Alberta,1360706 Alberta Ltd,"EDMONTON, AB T5Y 0P5",3,High Wage,7511,Transport truck drivers
Alberta,1380615 Alberta Ltd o/a Esso Westlock,"EDMONTON, AB T6L 6L2",1,High Wage,6211,Retail sales supervisors
Alberta,1387751 Alberta Ltd,"SEXSMITH, AB T0H 3C0",2,High Wage,6322,Cooks
Alberta,1392267 Alberta Ltd,"Vermilion, AB T9X 1J7",2,High Wage,6322,Cooks
Alberta,1404927 AB Ltd  o/a  Edson Family Chiropractic and Natural Health Institute.,"EDSON, AB T7E 1L4",1,High Wage,3236,Massage therapists
Alberta,1424482 Alberta Ltd,"Consort, AB T0C 1B0",1,High Wage,6525,Hotel front desk clerks
Alberta,1431716 Alberta Ltd o/a West Edmonton Truck Wash,"Edmonton, AB T5V 1M8",1,High Wage,1311,Accounting technicians and bookkeepers
Alberta,1475892 Alberta Ltd.,"Edmonton, AB T5Y 3N2",2,High Wage,7511,Transport truck drivers
Alberta,1482465 Alberta Ltd. o/a Edo Japan,"Leduc, AB T9E 8N4",1,High Wage,6322,Cooks
Alberta,1491312 Alberta Ltd.,"Edmonton, AB T6G 1E9",1,High Wage,6322,Cooks
Alberta,1500808 Alberta Ltd o/a India Palace Restaurant & Sweets,"Calgary, AB T3J 4X5",1,High Wage,6322,Cooks
Alberta,1501070 Alberta Ltd,"Sherwood Park, AB T8H 1R4",4,High Wage,6322,Cooks
Alberta,1533954 Alberta Ltd,"Edmonton, AB T6A 3Y3",1,High Wage,6731,Light duty cleaners
Alberta,1542804 Alberta Ltd,"NEW SAREPTA, AB T0B 3M0",2,High Wage,6322,Cooks
Alberta,1564946 Alberta Ltd o/a Optimum Immigration,"Edmonton, AB T6E 6B9",1,High Wage,1221,Administrative officers
Alberta,1584243 Alberta Ltd,"EDMONTON, AB T6T 0A8",3,High Wage,7511,Transport truck drivers
Alberta,1594625 Alberta Ltd. o/a Wendy's Restaurant,"Edmonton, AB T5A 5B5",2,High Wage,6311,Food service supervisors
Alberta,1604799 Alberta Ltd,"EDMONTON, AB T5Z 3R1",1,High Wage,7511,Transport truck drivers
